"","outlet","category","title","date","month","year","url"
"1","Welt","Digitalisierung","Ein Knopfdruck genügt",2013-06-25,6,2013,"https://www.welt.de/motor/article160307906/Ein-Knopfdruck-genuegt.html"
"2","Welt","Digitalisierung","Scannen oder scannen lassen?",2015-01-01,1,2015,"https://www.welt.de/wirtschaft/webwelt/article160309296/Scannen-oder-scannen-lassen.html"
"3","Welt","Digitalisierung","Hamburg, die digitale Hauptstadt Deutschlands",2015-02-08,2,2015,"https://www.welt.de/regionales/hamburg/article137240248/Hamburg-die-digitale-Hauptstadt-Deutschlands.html"
"4","Welt","Digitalisierung","Droht mit Digitalisierung jedem zweiten Job das Aus?",2016-01-11,1,2016,"https://www.welt.de/wirtschaft/webwelt/article150856398/Droht-mit-Digitalisierung-jedem-zweiten-Job-das-Aus.html"
"5","Welt","Digitalisierung","Wie Sie die Digitalisierung am Arbeitsplatz meistern",2016-03-29,3,2016,"https://www.welt.de/wirtschaft/article153754398/Wie-Sie-die-Digitalisierung-am-Arbeitsplatz-meistern.html"
"6","Welt","Digitalisierung","Woran die Digitalisierung der Schulen scheitert",2016-03-29,3,2016,"https://www.welt.de/politik/deutschland/article153777823/Woran-die-Digitalisierung-der-Schulen-scheitert.html"
"7","Welt","Digitalisierung","Hamburg plant kostenloses W-Lan für alle",2016-03-29,3,2016,"https://www.welt.de/regionales/hamburg/article153785443/Hamburg-plant-kostenloses-W-Lan-fuer-alle.html"
"8","Welt","Digitalisierung","Hamburg startet kostenloses WLAN-Netz für alle",2016-04-14,4,2016,"https://www.welt.de/regionales/hamburg/article154306709/Hamburg-startet-kostenloses-WLAN-Netz-fuer-alle.html"
"9","Welt","Digitalisierung","Diese Dax-Konzerne verpassen die Digitalisierung",2016-04-15,4,2016,"https://www.welt.de/wirtschaft/article154396023/Diese-Dax-Konzerne-verpassen-die-Digitalisierung.html"
"10","Welt","Digitalisierung","Das große Märchen vom Roboter als Jobkiller",2016-04-25,4,2016,"https://www.welt.de/wirtschaft/article154694243/Das-grosse-Maerchen-vom-Roboter-als-Jobkiller.html"
"11","Welt","Digitalisierung","Amerikas Attacke auf die deutsche Industrie-Herrschaft",2016-05-01,5,2016,"https://www.welt.de/wirtschaft/article154931786/Amerikas-Attacke-auf-die-deutsche-Industrie-Herrschaft.html"
"12","Welt","Digitalisierung","Snapchat oder Wie mich die Digitalisierung abhängte",2016-05-07,5,2016,"https://www.welt.de/kultur/medien/article155121656/Snapchat-oder-Wie-mich-die-Digitalisierung-abhaengte.html"
"13","Welt","Digitalisierung","Warum Digitalisierung gut für den Mittelstand ist",2016-05-19,5,2016,"https://www.welt.de/regionales/hamburg/article155493348/Warum-Digitalisierung-gut-fuer-den-Mittelstand-ist.html"
"14","Welt","Digitalisierung","Andrea Nahles‘ Pläne gehen am Arbeitsmarkt vorbei",2016-06-07,6,2016,"https://www.welt.de/debatte/kommentare/article156035726/Andrea-Nahles-Plaene-gehen-am-Arbeitsmarkt-vorbei.html"
"15","Welt","Digitalisierung","Warum Daimler Uber auf einmal gut findet",2016-06-09,6,2016,"https://www.welt.de/wirtschaft/webwelt/article156085241/Warum-Daimler-Uber-auf-einmal-gut-findet.html"
"16","Welt","Digitalisierung","Personalprofis stellen Chefaufsehern Armutszeugnis aus",2016-06-10,6,2016,"https://www.welt.de/wirtschaft/article156130781/Personalprofis-stellen-Chefaufsehern-Armutszeugnis-aus.html"
"17","Welt","Digitalisierung","Das sind die lukrativsten Jobs der neuen Arbeitswelt",2016-06-12,6,2016,"https://www.welt.de/wirtschaft/article156157198/Das-sind-die-lukrativsten-Jobs-der-neuen-Arbeitswelt.html"
"18","Welt","Digitalisierung","Roboter-Berater drängen bei den Banken nach vorn",2016-06-15,6,2016,"https://www.welt.de/finanzen/article156236995/Roboter-Berater-draengen-bei-den-Banken-nach-vorn.html"
"19","Welt","Digitalisierung","„Jeder vierte Arbeitnehmer steckt im falschen Job“",2016-06-19,6,2016,"https://www.welt.de/wirtschaft/article156354535/Jeder-vierte-Arbeitnehmer-steckt-im-falschen-Job.html"
"20","Welt","Digitalisierung","So gefährlich ist unsere Abhängigkeit vom Mobilfunk",2016-06-20,6,2016,"https://www.welt.de/wirtschaft/webwelt/article156363729/So-gefaehrlich-ist-unsere-Abhaengigkeit-vom-Mobilfunk.html"
"21","Welt","Digitalisierung","„Die niedrigen Zinsen verursachen enormen Schaden“",2016-06-20,6,2016,"https://www.welt.de/wirtschaft/article156363717/Die-niedrigen-Zinsen-verursachen-enormen-Schaden.html"
"22","Welt","Digitalisierung","Fehlerhafte Implantate – Ausweis kann Leben retten",2016-06-20,6,2016,"https://www.welt.de/regionales/hamburg/article156365423/Fehlerhafte-Implantate-Ausweis-kann-Leben-retten.html"
"23","Welt","Digitalisierung","Wie Roboter unsere Welt verändern werden",2016-06-20,6,2016,"https://www.welt.de/regionales/hamburg/article156375634/Wie-Roboter-unsere-Welt-veraendern-werden.html"
"24","Welt","Digitalisierung","Erster! Wir sind schon den neuen Panamera gefahren",2016-06-22,6,2016,"https://www.welt.de/motor/article156407737/Erster-Wir-sind-schon-den-neuen-Panamera-gefahren.html"
"25","Welt","Digitalisierung","So will die EU jetzt Roboter per Gesetz bändigen",2016-06-22,6,2016,"https://www.welt.de/wirtschaft/article156463323/So-will-die-EU-jetzt-Roboter-per-Gesetz-baendigen.html"
"26","Welt","Digitalisierung","Wenn das Handy meldet, dass die Windel voll ist",2016-06-25,6,2016,"https://www.welt.de/wirtschaft/article156561469/Wenn-das-Handy-meldet-dass-die-Windel-voll-ist.html"
"27","Welt","Digitalisierung","„Wir brauchen Lust am Fortschritt“",2016-06-28,6,2016,"https://www.welt.de/regionales/nrw/article156617020/Wir-brauchen-Lust-am-Fortschritt.html"
"28","Welt","Digitalisierung","Jetzt will Angela Merkel die EU „optimieren“",2016-07-02,7,2016,"https://www.welt.de/politik/deutschland/article156757361/Jetzt-will-Angela-Merkel-die-EU-optimieren.html"
"29","Welt","Digitalisierung","Ab wann sollte man Kinder an den Computer lassen?",2016-07-03,7,2016,"https://www.welt.de/regionales/bayern/article156735966/Ab-wann-sollte-man-Kinder-an-den-Computer-lassen.html"
"30","Welt","Digitalisierung","Liebe Technikfeinde, der Fortschritt kommt sowieso",2016-07-07,7,2016,"https://www.welt.de/debatte/kommentare/article156878031/Liebe-Technikfeinde-der-Fortschritt-kommt-sowieso.html"
"31","Welt","Digitalisierung","Post-Chef will die Arbeit von Robotern besteuern",2016-07-10,7,2016,"https://www.welt.de/wirtschaft/article156922755/Post-Chef-will-die-Arbeit-von-Robotern-besteuern.html"
"32","Welt","Digitalisierung","Eine Waagenfabrik auf dem Weg in die Zukunft",2016-07-11,7,2016,"https://www.welt.de/regionales/hamburg/article156958168/Eine-Waagenfabrik-auf-dem-Weg-in-die-Zukunft.html"
"33","Welt","Digitalisierung","Diese Länder sind führend in der digitalen Wirtschaft",2016-07-12,7,2016,"https://www.welt.de/wirtschaft/bilanz/article161760154/Diese-Laender-sind-fuehrend-in-der-digitalen-Wirtschaft.html"
"34","Welt","Digitalisierung","Burger-Brater ist ein Beruf mit großer Zukunft",2016-07-14,7,2016,"https://www.welt.de/wirtschaft/article157031431/Burger-Brater-ist-ein-Beruf-mit-grosser-Zukunft.html"
"35","Welt","Digitalisierung","Siemens möchte zum Apple der Industrie werden",2016-07-19,7,2016,"https://www.welt.de/wirtschaft/article157171400/Siemens-moechte-zum-Apple-der-Industrie-werden.html"
"36","Welt","Digitalisierung","Dieser Mann leistet bei Porsche Entwicklungshilfe",2016-07-20,7,2016,"https://www.welt.de/motor/article157072054/Dieser-Mann-leistet-bei-Porsche-Entwicklungshilfe.html"
"37","Welt","Digitalisierung","Wem gehört die Erinnerung an ein totes Kind?",2016-07-21,7,2016,"https://www.welt.de/wirtschaft/plus157152039/Wem-gehoert-die-Erinnerung-an-ein-totes-Kind.html"
"38","Welt","Digitalisierung","Warum wir schon bald völlig anders arbeiten",2016-07-23,7,2016,"https://www.welt.de/wirtschaft/article157235743/Warum-wir-schon-bald-voellig-anders-arbeiten.html"
"39","Welt","Digitalisierung","Das passiert, wenn ich nur noch Überschriften lese",2016-07-24,7,2016,"https://www.welt.de/kultur/medien/article157258253/Das-passiert-wenn-ich-nur-noch-Ueberschriften-lese.html"
"40","Welt","Digitalisierung","Wie die Digitalisierung das Reederei-Geschäft wandelt",2016-07-26,7,2016,"https://www.welt.de/regionales/hamburg/article157312904/Wie-die-Digitalisierung-das-Reederei-Geschaeft-wandelt.html"
"41","Welt","Digitalisierung","Die unheimliche Macht der Tech-Giganten",2016-08-01,8,2016,"https://www.welt.de/wirtschaft/article157395712/Die-unheimliche-Macht-der-Tech-Giganten.html"
"42","Welt","Digitalisierung","Axel Springer profitiert von digitaler Ausrichtung",2016-08-03,8,2016,"https://www.welt.de/wirtschaft/article157479126/Axel-Springer-profitiert-von-digitaler-Ausrichtung.html"
"43","Welt","Digitalisierung","Die Digitalisierung hat das Handwerk erfasst",2016-08-06,8,2016,"https://www.welt.de/regionales/bayern/article157518419/Die-Digitalisierung-hat-das-Handwerk-erfasst.html"
"44","Welt","Digitalisierung","HVV-Tarife sollen 2017 erneut steigen",2016-08-09,8,2016,"https://www.welt.de/regionales/hamburg/article157572394/HVV-Tarife-sollen-2017-erneut-steigen.html"
"45","Welt","Digitalisierung","Wie man Schüler vor dem Amoklauf bewahrt",2016-08-15,8,2016,"https://www.welt.de/gesundheit/psychologie/article157627762/Wie-man-Schueler-vor-dem-Amoklauf-bewahrt.html"
"46","Welt","Digitalisierung","Londoner Taxifahrer haben eine Navi-App im Kopf",2016-08-26,8,2016,"https://www.welt.de/motor/article157859069/Londoner-Taxifahrer-haben-eine-Navi-App-im-Kopf.html"
"47","Welt","Digitalisierung","Roboter werden Millionen Jobs vernichten",2016-08-27,8,2016,"https://www.welt.de/wirtschaft/plus157872907/Roboter-werden-Millionen-Jobs-vernichten.html"
"48","Welt","Digitalisierung","Was hätte dieser Mann mit dem Internet angestellt?",2016-08-28,8,2016,"https://www.welt.de/kultur/kunst-und-architektur/article157874297/Was-haette-dieser-Mann-mit-dem-Internet-angestellt.html"
"49","Welt","Digitalisierung","Bosch startet das DriveNow für Waschmaschinen",2016-09-02,9,2016,"https://www.welt.de/wirtschaft/webwelt/article157932089/Bosch-startet-das-DriveNow-fuer-Waschmaschinen.html"
"50","Welt","Digitalisierung","Lkw ohne Fahrer wird für Lastwagenbauer zum Problem",2016-09-04,9,2016,"https://www.welt.de/wirtschaft/article157951003/Lkw-ohne-Fahrer-wird-fuer-Lastwagenbauer-zum-Problem.html"
"51","Welt","Digitalisierung","Grabt den Populisten das Wasser ab!",2016-09-07,9,2016,"https://www.welt.de/wirtschaft/article157975667/Grabt-den-Populisten-das-Wasser-ab.html"
"52","Welt","Digitalisierung","„Hamburg ist Top-Standort der digitalen Branche“",2016-09-07,9,2016,"https://www.welt.de/regionales/hamburg/article157984916/Hamburg-ist-Top-Standort-der-digitalen-Branche.html"
"53","Welt","Digitalisierung","Wo ist nur der deutsche Erfindergeist geblieben?",2016-09-07,9,2016,"https://www.welt.de/debatte/kommentare/article157984060/Wo-ist-nur-der-deutsche-Erfindergeist-geblieben.html"
"54","Welt","Digitalisierung","„Carsharing ist nur ein Übergangsmodell“",2016-09-08,9,2016,"https://www.welt.de/regionales/hamburg/article158007273/Carsharing-ist-nur-ein-Uebergangsmodell.html"
"55","Welt","Digitalisierung","„Ich erwarte erste unbemannte Frachter in zehn Jahren“",2016-09-08,9,2016,"https://www.welt.de/regionales/hamburg/article158010747/Ich-erwarte-erste-unbemannte-Frachter-in-zehn-Jahren.html"
"56","Welt","Digitalisierung","Wir sind die Gewinner und kapieren es nicht",2016-09-09,9,2016,"https://www.welt.de/debatte/kommentare/article158015371/Wir-sind-die-Gewinner-und-kapieren-es-nicht.html"
"57","Welt","Digitalisierung","Roboter werden die Menschen noch kreativer machen",2016-09-11,9,2016,"https://www.welt.de/debatte/kommentare/article158048684/Roboter-werden-die-Menschen-noch-kreativer-machen.html"
"58","Welt","Digitalisierung","Dieses Ding weiß, ob Ihr Auto abgeschlossen ist",2016-09-14,9,2016,"https://www.welt.de/wirtschaft/webwelt/article158136533/Dieses-Ding-weiss-ob-Ihr-Auto-abgeschlossen-ist.html"
"59","Welt","Digitalisierung","So digitalisieren Sie Ihre alten Videokassetten",2016-09-16,9,2016,"https://www.welt.de/wirtschaft/webwelt/article158194195/So-digitalisieren-Sie-Ihre-alten-Videokassetten.html"
"60","Welt","Digitalisierung","Verkommt die deutsche Industrie zur Werkbank für Apple?",2016-09-19,9,2016,"https://www.welt.de/wirtschaft/article158233272/Verkommt-die-deutsche-Industrie-zur-Werkbank-fuer-Apple.html"
"61","Welt","Digitalisierung","„Bildschirme sind nur eine Brückentechnologie“",2016-09-20,9,2016,"https://www.welt.de/regionales/hamburg/article158272003/Bildschirme-sind-nur-eine-Brueckentechnologie.html"
"62","Welt","Digitalisierung","Die digitale Revolution gibt es nicht",2016-09-23,9,2016,"https://www.welt.de/wirtschaft/bilanz/article161356886/Die-digitale-Revolution-gibt-es-nicht.html"
"63","Welt","Digitalisierung","Deutschland steht beim Breitbandausbau auf der Leitung",2016-09-24,9,2016,"https://www.welt.de/wirtschaft/article158349026/Deutschland-steht-beim-Breitbandausbau-auf-der-Leitung.html"
"64","Welt","Digitalisierung","Wenn die Bank Umsätze mitliest und Kauf-Ideen gibt",2016-09-26,9,2016,"https://www.welt.de/wirtschaft/plus158366144/Wenn-die-Bank-Umsaetze-mitliest-und-Kauf-Ideen-gibt.html"
"65","Welt","Digitalisierung","Facebook soll reguliert und beaufsichtigt werden",2016-09-26,9,2016,"https://www.welt.de/wirtschaft/article158390206/Facebook-soll-reguliert-und-beaufsichtigt-werden.html"
"66","Welt","Digitalisierung","Ständige Erreichbarkeit belastet Familienleben",2016-09-27,9,2016,"https://www.welt.de/gesundheit/video158408570/Staendige-Erreichbarkeit-belastet-Familienleben.html"
"67","Welt","Digitalisierung","So krank macht uns die digitale Arbeitswelt",2016-09-27,9,2016,"https://www.welt.de/wirtschaft/article158408792/So-krank-macht-uns-die-digitale-Arbeitswelt.html"
"68","Welt","Digitalisierung","Wie schmeckt Weingummi aus dem 3D-Drucker?",2016-09-28,9,2016,"https://www.welt.de/regionales/hamburg/article158415359/Wie-schmeckt-Weingummi-aus-dem-3D-Drucker.html"
"69","Welt","Digitalisierung","Commerzbank streicht 9600 Stellen",2016-09-29,9,2016,"https://www.welt.de/wirtschaft/article158437597/Commerzbank-streicht-9600-Stellen.html"
"70","Welt","Digitalisierung","Deutsche Bank greift sich nun auch selbst an",2016-09-29,9,2016,"https://www.welt.de/wirtschaft/article158452500/Deutsche-Bank-greift-sich-nun-auch-selbst-an.html"
"71","Welt","Digitalisierung","Interaktives Lernen mit digitaler Technik",2016-10-12,10,2016,"https://www.welt.de/politik/video158716190/Interaktives-Lernen-mit-digitaler-Technik.html"
"72","Welt","Digitalisierung","So will Bastei Lübbe seinen ramponierten Ruf retten",2016-10-12,10,2016,"https://www.welt.de/wirtschaft/plus158705715/So-will-Bastei-Luebbe-seinen-ramponierten-Ruf-retten.html"
"73","Welt","Digitalisierung","Wie Siemens im digitalen Zeitalter bestehen will",2016-10-19,10,2016,"https://www.welt.de/regionales/hamburg/article158885845/Wie-Siemens-im-digitalen-Zeitalter-bestehen-will.html"
"74","Welt","Digitalisierung","Wir brauchen Nerds und Freaks auf Chefposten",2016-10-20,10,2016,"https://www.welt.de/wirtschaft/article158889538/Wir-brauchen-Nerds-und-Freaks-auf-Chefposten.html"
"75","Welt","Digitalisierung","Eltern, überwacht Eure Kinder!",2016-10-20,10,2016,"https://www.welt.de/debatte/kommentare/article158911124/Eltern-ueberwacht-Eure-Kinder.html"
"76","Welt","Digitalisierung","Auswirkungen des digitalen Wandels auf die Arbeitswelt",2016-10-24,10,2016,"https://www.welt.de/wirtschaft/karriere/article160311512/Auswirkungen-des-digitalen-Wandels-auf-die-Arbeitswelt.html"
"77","Welt","Digitalisierung","Die seltsame Angst vor der digitalen Patientenakte",2016-10-25,10,2016,"https://www.welt.de/wirtschaft/article159020781/Die-seltsame-Angst-vor-der-digitalen-Patientenakte.html"
"78","Welt","Digitalisierung","Martin Luther wäre heute vermutlich ein Blogger",2016-10-28,10,2016,"https://www.welt.de/sonderthemen/luther-2017/article159063912/Martin-Luther-waere-heute-vermutlich-ein-Blogger.html"
"79","Welt","Digitalisierung","„Publishing ist kein Beruf. Es ist ein Knopf“",2016-11-05,11,2016,"https://www.welt.de/kultur/literarischewelt/article159278178/Publishing-ist-kein-Beruf-Es-ist-ein-Knopf.html"
"80","Welt","Digitalisierung","Die klassische Putzfrau braucht bald niemand mehr",2016-11-06,11,2016,"https://www.welt.de/wirtschaft/article159290879/Die-klassische-Putzfrau-braucht-bald-niemand-mehr.html"
"81","Welt","Digitalisierung","Deutsche Schüler sind digitale Analphabeten",2016-11-07,11,2016,"https://www.welt.de/wirtschaft/karriere/bildung/article159317713/Deutsche-Schueler-sind-digitale-Analphabeten.html"
"82","Welt","Digitalisierung","Der Traum von einer Welt ohne Mittler",2016-11-08,11,2016,"https://www.welt.de/sonderthemen/mittelstand/finanzierung/article159335630/Der-Traum-von-einer-Welt-ohne-Mittler.html"
"83","Welt","Digitalisierung","Paketboten bekommen einen elektrischen Begleiter",2016-11-08,11,2016,"https://www.welt.de/wirtschaft/article159347729/Paketboten-bekommen-einen-elektrischen-Begleiter.html"
"84","Welt","Digitalisierung","Das sind die besten Städte für Fintech-Unternehmen",2016-11-10,11,2016,"https://www.welt.de/wirtschaft/bilanz/article161725056/Das-sind-die-besten-Staedte-fuer-Fintech-Unternehmen.html"
"85","Welt","Digitalisierung","Big McDonald, Präsident der verbitterten Herzen",2016-11-13,11,2016,"https://www.welt.de/debatte/kommentare/article159451036/Big-McDonald-Praesident-der-verbitterten-Herzen.html"
"86","Welt","Digitalisierung","Trump gab dem Globalisierungsfrust eine Stimme",2016-11-14,11,2016,"https://www.welt.de/politik/deutschland/article159452886/Trump-gab-dem-Globalisierungsfrust-eine-Stimme.html"
"87","Welt","Digitalisierung","Wir brauchen eine digitale Emanzipation",2016-11-14,11,2016,"https://www.welt.de/debatte/kommentare/article159486196/Wir-brauchen-eine-digitale-Emanzipation.html"
"88","Welt","Digitalisierung","Gegen Gatekeeper hilft nur die GEZ",2016-11-15,11,2016,"https://www.welt.de/kultur/literarischewelt/article159506249/Gegen-Gatekeeper-hilft-nur-die-GEZ.html"
"89","Welt","Digitalisierung","Dieses Jahr bittet die Kanzlerin nur zum Stehempfang",2016-11-15,11,2016,"https://www.welt.de/wirtschaft/article159507775/Dieses-Jahr-bittet-die-Kanzlerin-nur-zum-Stehempfang.html"
"90","Welt","Digitalisierung","Wird das eigene Smartphone zur Pflicht für Schüler?",2016-11-16,11,2016,"https://www.welt.de/politik/deutschland/article159524325/Wird-das-eigene-Smartphone-zur-Pflicht-fuer-Schueler.html"
"91","Welt","Digitalisierung","Wie Schüler in Zukunft lernen",2016-11-18,11,2016,"https://www.welt.de/vermischtes/video159576461/So-koennte-das-Lernen-der-Zukunft-aussehen.html"
"92","Welt","Digitalisierung","Die Digitalisierung ist stärker als Trump",2016-11-18,11,2016,"https://www.welt.de/debatte/kommentare/article159598510/Die-Digitalisierung-ist-staerker-als-Trump.html"
"93","Welt","Digitalisierung","Wie viel Ihr neues Auto über Sie weiß – und weitergibt",2016-11-21,11,2016,"https://www.welt.de/wirtschaft/article159657322/Wie-viel-Ihr-neues-Auto-ueber-Sie-weiss-und-weitergibt.html"
"94","Welt","Digitalisierung","Weitermerkeln? Nein! Jetzt steht eine Revolution an",2016-11-21,11,2016,"https://www.welt.de/politik/deutschland/article159660223/Weitermerkeln-Nein-Jetzt-steht-eine-Revolution-an.html"
"95","Welt","Digitalisierung","Pseudo-Wohltaten helfen nicht gegen Neo-Nationalisten",2016-11-25,11,2016,"https://www.welt.de/wirtschaft/article159751872/Pseudo-Wohltaten-helfen-nicht-gegen-Neo-Nationalisten.html"
"96","Welt","Digitalisierung","„Eine Herausforderung - auch für den Staat“",2016-11-29,11,2016,"https://www.welt.de/vermischtes/video159834411/Eine-Herausforderung-auch-fuer-den-Staat.html"
"97","Welt","Digitalisierung","Das Phantom vom „Ende der Arbeit“",2016-11-29,11,2016,"https://www.welt.de/wirtschaft/article159846802/Das-Phantom-vom-Ende-der-Arbeit.html"
"98","Welt","Digitalisierung","Warum ein Foto eben doch kein Gemälde ist",2016-11-30,11,2016,"https://www.welt.de/debatte/kommentare/article159861470/Warum-ein-Foto-eben-doch-kein-Gemaelde-ist.html"
"99","Welt","Digitalisierung","Für Personalchefs ist Erfahrung wichtiger als Zeugnisse",2016-12-04,12,2016,"https://www.welt.de/wirtschaft/karriere/bildung/article159948842/Fuer-Personalchefs-ist-Erfahrung-wichtiger-als-Zeugnisse.html"
"100","Welt","Digitalisierung","Merkel schürt Angst – und bietet sich als Lösung an",2016-12-06,12,2016,"https://www.welt.de/politik/deutschland/article160052618/Merkel-schuert-Angst-und-bietet-sich-als-Loesung-an.html"
"101","Welt","Digitalisierung","Schüler sollen Smartphones nicht mehr abschalten",2016-12-08,12,2016,"https://www.welt.de/politik/deutschland/article160125462/Schueler-sollen-Smartphones-nicht-mehr-abschalten.html"
"102","Welt","Digitalisierung","Warum die Nationalbibliothek keine Bücher mehr ausleiht",2016-12-11,12,2016,"https://www.welt.de/kultur/literarischewelt/plus160186706/Warum-die-Nationalbibliothek-keine-Buecher-mehr-ausleiht.html"
"103","Welt","Digitalisierung","Diese Berufe haben wirklich Zukunft",2016-12-27,12,2016,"https://www.welt.de/wirtschaft/plus160581317/Diese-Berufe-haben-wirklich-Zukunft.html"
"104","Welt","Digitalisierung","Was bringt 2017 – Roboterkriege oder Weltrettung?",2016-12-28,12,2016,"https://www.welt.de/regionales/hamburg/article160645479/Was-bringt-2017-Roboterkriege-oder-Weltrettung.html"
"105","Welt","Digitalisierung","Wenn der Einkauf den Geburtstermin des Babys verrät",2016-12-29,12,2016,"https://www.welt.de/regionales/hamburg/article160703307/Wenn-der-Einkauf-den-Geburtstermin-des-Babys-verraet.html"
"106","Welt","Digitalisierung","Polizei kann bei Stromausfall nur zwei Stunden funken",2017-01-02,1,2017,"https://www.welt.de/politik/article160768875/Polizei-kann-bei-Stromausfall-nur-zwei-Stunden-funken.html"
"107","Welt","Digitalisierung","Finlab, Peter Thiel und Christian Angermayer verbünden sich",2017-01-02,1,2017,"https://www.welt.de/wirtschaft/bilanz/article163028861/Finlab-Peter-Thiel-und-Christian-Angermayer-verbuenden-sich.html"
"108","Welt","Digitalisierung","In der Silvesternacht versagte der Polizeifunk",2017-01-03,1,2017,"https://www.welt.de/politik/article160810746/In-der-Silvesternacht-versagte-der-Polizeifunk.html"
"109","Welt","Digitalisierung","So haben Sie München noch nie gesehen",2017-01-05,1,2017,"https://www.welt.de/regionales/bayern/article160892960/So-haben-Sie-Muenchen-noch-nie-gesehen.html"
"110","Welt","Digitalisierung","Die unsinnige Angst vor der „säkularen Stagnation“",2017-01-10,1,2017,"https://www.welt.de/wirtschaft/article161022803/Die-unsinnige-Angst-vor-der-saekularen-Stagnation.html"
"111","Welt","Digitalisierung","Die Lage am deutschen Arbeitsmarkt",2017-01-11,1,2017,"https://www.welt.de/videos/video161101192/Die-Lage-am-deutschen-Arbeitsmarkt.html"
"112","Welt","Digitalisierung","„Ich wünsche mir mehr Respekt von den Älteren“",2017-01-12,1,2017,"https://www.welt.de/politik/deutschland/plus161079653/Ich-wuensche-mir-mehr-Respekt-von-den-Aelteren.html"
"113","Welt","Digitalisierung","CDU will flächendeckendes 5G-Netz bis zum Jahr 2020",2017-01-12,1,2017,"https://www.welt.de/politik/deutschland/article161122178/CDU-will-flaechendeckendes-5G-Netz-bis-zum-Jahr-2020.html"
"114","Welt","Digitalisierung","„Das steht doch alles bei Wikipedia“",2017-01-13,1,2017,"https://www.welt.de/sonderthemen/medienkongress/article161134450/Das-steht-doch-alles-bei-Wikipedia.html"
"115","Welt","Digitalisierung","Mit Trump ist ein Happy End noch möglich",2017-01-17,1,2017,"https://www.welt.de/wirtschaft/article161247177/Mit-Trump-ist-ein-Happy-End-noch-moeglich.html"
"116","Welt","Digitalisierung","Darum müssen wir uns nicht vor Arbeitslosigkeit fürchten",2017-01-17,1,2017,"https://www.welt.de/wirtschaft/article161000490/Darum-muessen-wir-uns-nicht-vor-Arbeitslosigkeit-fuerchten.html"
"117","Welt","Digitalisierung","Top-Manager schätzen Menschen geringer als Maschinen",2017-01-20,1,2017,"https://www.welt.de/wirtschaft/article161335580/Top-Manager-schaetzen-Menschen-geringer-als-Maschinen.html"
"118","Welt","Digitalisierung","Eine Kindheit zwischen Schulhort und Youporn",2017-01-23,1,2017,"https://www.welt.de/regionales/nrw/article161369565/Eine-Kindheit-zwischen-Schulhort-und-Youporn.html"
"119","Welt","Digitalisierung","Königin Máxima und ihre Mahnung an die Banken",2017-01-25,1,2017,"https://www.welt.de/wirtschaft/article161510903/Koenigin-Maxima-und-ihre-Mahnung-an-die-Banken.html"
"120","Welt","Digitalisierung","Die vernetzte Zukunft beginnt in einer Kirche",2017-01-26,1,2017,"https://www.welt.de/sonderthemen/aachen/article161545503/Die-vernetzte-Zukunft-beginnt-in-einer-Kirche.html"
"121","Welt","Digitalisierung","Paradox, doch wahr - Flexibilität bringt Sicherheit",2017-01-29,1,2017,"https://www.welt.de/debatte/kommentare/article161622653/Paradox-doch-wahr-Flexibilitaet-bringt-Sicherheit.html"
"122","Welt","Digitalisierung","„Das war die alte Polemik gegen Neoliberalismus“",2017-01-30,1,2017,"https://www.welt.de/politik/deutschland/article161636210/Das-war-die-alte-Polemik-gegen-Neoliberalismus.html"
"123","Welt","Digitalisierung","Warum Frau Tang ein Segen für die Politik ist",2017-01-31,1,2017,"https://www.welt.de/politik/ausland/article161656723/Warum-Frau-Tang-ein-Segen-fuer-die-Politik-ist.html"
"124","Welt","Digitalisierung","Wer möchte eigentlich autonome Autos?",2017-02-02,2,2017,"https://www.welt.de/motor/article161683542/Wer-moechte-eigentlich-autonome-Autos.html"
"125","Welt","Digitalisierung","Hamburg will in die digitale Spitzenliga aufsteigen",2017-02-03,2,2017,"https://www.welt.de/regionales/hamburg/article161795441/Hamburg-will-in-die-digitale-Spitzenliga-aufsteigen.html"
"126","Welt","Digitalisierung","„Internetsucht ist immer eine Definitionssache“",2017-02-08,2,2017,"https://www.welt.de/regionales/hamburg/article161916551/Internetsucht-ist-immer-eine-Definitionssache.html"
