"","outlet","category","title","date","month","year","url"
"707","Welt","Digitalisierung","Diese Rangliste entblößt Deutschlands digitales Versagen",2018-12-10,12,2018,"https://www.welt.de/wirtschaft/article185201234/PwC-Studie-Deutschland-ist-unattraktivster-Standort-fuer-Digital-Investitionen.html"
"708","Welt","Digitalisierung","Selbst der Wirtschaftsminister schämt sich für das deutsche Handynetz",2018-12-11,12,2018,"https://www.welt.de/vermischtes/article185320210/TV-Kritik-Hart-aber-fair-Selbst-Altmaier-schaemt-sich-fuers-Handynetz.html"
"709","Welt","Digitalisierung","„Dass die Schulen so hinterherhinken, ist peinlich“",2018-12-11,12,2018,"https://www.welt.de/politik/deutschland/plus185217758/Grundgesetzaenderung-fuer-Digitalpakt-gescheitert-Viele-Schulleiter-sind-fassungslos.html"
"710","Welt","Digitalisierung","Söder verspricht stabile Regierungsarbeit",2018-12-11,12,2018,"https://www.welt.de/regionales/bayern/article185363202/Bayerischer-Landtag-Soeder-verspricht-stabile-Regierungsarbeit.html"
"711","Welt","Digitalisierung","Die Deutschen überschätzen sich",2018-12-14,12,2018,"https://www.welt.de/wirtschaft/article185495950/Jobs-in-Gefahr-Die-Deutschen-ueberschaetzen-sich.html"
"712","Welt","Digitalisierung","Grundgesetzänderung für Digitalpakt gestoppt",2018-12-14,12,2018,"https://www.welt.de/regionales/mecklenburg-vorpommern/video185525568/Bundesrat-Grundgesetzaenderung-fuer-Digitalpakt-gestoppt.html"
"713","Welt","Digitalisierung","Digitaler Schulalltag rückt wieder in weite Ferne",2018-12-14,12,2018,"https://www.welt.de/regionales/hamburg/article185546482/Digitalpakt-Digitaler-Schulalltag-rueckt-wieder-in-weite-Ferne.html"
"714","Welt","Digitalisierung","Schluss mit der oberflächlichen Digitalisierungspolitik",2018-12-19,12,2018,"https://www.welt.de/debatte/kommentare/article185396466/Digitalisierung-Zukunftsblindheit-koennen-wir-uns-nicht-mehr-leisten.html"
"715","Welt","Digitalisierung","„Kumpelromantik kann wirklich keiner mehr hören“",2018-12-21,12,2018,"https://www.welt.de/regionales/nrw/article185850250/Dokumentation-ueber-Kohle-Aus-Kumpelromantik-kann-wirklich-keiner-mehr-hoeren.html"
"716","Welt","Digitalisierung","DRK-Präsidentin – Auch soziale Angebote müssen online sein",2018-12-21,12,2018,"https://www.welt.de/regionales/bayern/article185924104/Digitalisierung-DRK-Praesidentin-Auch-soziale-Angebote-muessen-online-sein.html"
"717","Welt","Digitalisierung","Dorothee Bär will Datenschutz für Patienten lockern",2018-12-23,12,2018,"https://www.welt.de/wirtschaft/article186013534/Dorothee-Baer-will-Datenschutz-fuer-Patienten-lockern.html"
"718","Welt","Digitalisierung","Das Schicksal der Weihnachtsgans sollte uns eine Warnung sein",2018-12-24,12,2018,"https://www.welt.de/wirtschaft/article186039694/Digitalisierung-Im-Strukturwandel-verhalten-sich-Menschen-wie-Weihnachtsgaense.html"
"719","Welt","Digitalisierung","Softwareentwickler sind kreative Zahlenkünstler",2018-12-24,12,2018,"https://www.welt.de/regionales/nrw/article186063382/Softwareentwickler-sind-kreative-Zahlenkuenstler.html"
"720","Welt","Digitalisierung","„Ich bin dem Arzt immer irgendwie ausgeliefert“",2018-12-26,12,2018,"https://www.welt.de/wirtschaft/article186076134/Dorothee-Baer-Ich-bin-dem-Arzt-immer-irgendwie-ausgeliefert.html"
"721","Welt","Digitalisierung","Wenn ein Computer über die Therapie entscheidet",2018-12-26,12,2018,"https://www.welt.de/gesundheit/article185923740/Kuenstliche-Intelligenz-Wenn-ein-Computer-die-Behandlung-uebernimmt.html"
"722","Welt","Digitalisierung","Kuba lernt den digitalen Widerstand",2018-12-26,12,2018,"https://www.welt.de/politik/ausland/article186076420/Lebensmittelkrise-Kuba-lernt-den-digitalen-Widerstand.html"
"723","Welt","Digitalisierung","„Die Furcht vor den Fremden ist ein Systemproblem“",2018-12-26,12,2018,"https://www.welt.de/politik/deutschland/plus186038692/Stefan-Hertmans-Ueber-die-Krise-der-Demokratie-in-westlichen-Staaten.html"
"724","Welt","Digitalisierung","Die zehn Regeln der Kundenbegeisterung",2018-12-27,12,2018,"https://www.welt.de/wirtschaft/bilanz/article186163360/Servicequalitaet-Die-zehn-Regeln-der-Kundenbegeisterung.html"
"725","Welt","Digitalisierung","Falsches Verständnis der Digitalisierung führt zu hohen Kosten",2018-12-28,12,2018,"https://www.welt.de/wirtschaft/bilanz/article186234062/Insurtec-Falsches-Verstaendnis-der-Digitalisierung-fuehrt-zu-hohen-Kosten.html"
"726","Welt","Digitalisierung","„Wir Grünen müssen schön auf dem Teppich bleiben“",2018-12-31,12,2018,"https://www.welt.de/politik/deutschland/article186113326/Minister-Jan-Philipp-Albrecht-Gruene-muessen-auf-dem-Teppich-bleiben.html"
"727","Welt","Digitalisierung","Fünf Thesen zur digitalen Transformation",2018-12-31,12,2018,"https://www.welt.de/wirtschaft/bilanz/article186346234/Management-Fuenf-Thesen-zur-digitalen-Transformation.html"
"728","Welt","Digitalisierung","Es gibt kein Recht auf Arbeit, Frau Nahles",2019-01-01,1,2019,"https://www.welt.de/wirtschaft/article186368528/Zukunft-der-Arbeit-Warum-Andrea-Nahles-falsch-liegt.html"
"729","Welt","Digitalisierung","Wo der Gast das Zimmer per Smartphone steuert",2019-01-02,1,2019,"https://www.welt.de/reise/nah/article185730048/Hotel-der-Zukunft-Der-Gast-steuert-das-Zimmer-per-Smartphone.html"
"730","Welt","Digitalisierung","Warum Obdachlose unter der Digitalisierung leiden",2019-01-02,1,2019,"https://www.welt.de/regionales/nrw/article186434948/Warum-Obdachlose-unter-der-Digitalisierung-leiden.html"
"731","Welt","Digitalisierung","„Familienunternehmer neigen nicht zur Panik“",2019-01-03,1,2019,"https://www.welt.de/wirtschaft/bilanz/article186433330/Digitalisierung-Familienunternehmer-neigen-nicht-zur-Panik.html"
"732","Welt","Digitalisierung","2019 wird ein gutes Jahr. Die Regierung braucht nur Mut",2019-01-04,1,2019,"https://www.welt.de/debatte/kommentare/article186422452/Konjunktur-Warum-2019-ein-wirtschaftlich-gutes-Jahr-werden-koennte.html"
"733","Welt","Digitalisierung","Das bedingungslose Grundeinkommen ist ein Irrweg",2019-01-07,1,2019,"https://www.welt.de/debatte/kommentare/article186657296/Oekonom-Bedingungsloses-Grundeinkommen-ist-ein-Irrweg.html"
"734","Welt","Digitalisierung","Wie Deutschland seinen digitalen Rückstand aufholen soll",2019-01-09,1,2019,"https://www.welt.de/wirtschaft/article186831556/Welt-Wirtschaftsgipfel-Deutschland-hinkt-bei-Digitalisierung-hinterher.html"
"735","Welt","Digitalisierung","Auch die KFZ-Zulassung soll endlich digital werden",2019-01-09,1,2019,"https://www.welt.de/politik/deutschland/video186829254/Verwaltung-Auch-die-KFZ-Zulassung-soll-endlich-digital-werden.html"
"736","Welt","Digitalisierung","In der digitalen Welt muss sich auch jeder selbst schützen",2019-01-10,1,2019,"https://www.welt.de/debatte/kommentare/article186793708/Frederick-Richter-Fuer-mehr-Selbstschutz-in-der-digitalen-Welt.html"
"737","Welt","Digitalisierung","Der Staat verschwendet unsere Lebenszeit",2019-01-10,1,2019,"https://www.welt.de/debatte/kommentare/article186779630/Marco-Buschmann-FDP-Der-Staat-verschwendet-unsere-Lebenszeit.html"
"738","Welt","Digitalisierung","NRW im Auge der Spione",2019-01-12,1,2019,"https://www.welt.de/regionales/nrw/article186923680/Industriespionage-Alle-Branchen-in-NRW-betroffen.html"
"739","Welt","Digitalisierung","2019 könnte nicht nur Europa bis zur Unkenntlichkeit deformiert werden",2019-01-12,1,2019,"https://www.welt.de/debatte/kommentare/plus186936904/Deutsche-Wirtschaft-2019-koennte-nicht-nur-Europa-bis-zur-Unkenntlichkeit-deformiert-werden.html"
"740","Welt","Digitalisierung","DGB-Chef Hoffmann warnt vor einem „digitalen Proletariat“",2019-01-13,1,2019,"https://www.welt.de/wirtschaft/article186967644/DGB-Chef-Hoffmann-warnt-vor-digitalem-Proletariat.html"
"741","Welt","Digitalisierung","App im Schweinestall soll das Leben von Tieren und Bauern besser machen",2019-01-14,1,2019,"https://www.welt.de/regionales/hamburg/article187011036/DigiPig-App-im-Schweinestall-soll-das-Leben-von-Tieren-und-Bauern-besser-machen.html"
"742","Welt","Digitalisierung","Das deutsche Hadern mit der Zuwanderung überschattet das wahre Problem",2019-01-14,1,2019,"https://www.welt.de/wirtschaft/article187033382/Das-deutsche-Hadern-mit-der-Zuwanderung-ueberschattet-das-wahre-Problem.html"
"743","Welt","Digitalisierung","„Das ist der Verteilungskampf, vor dem wir stehen“",2019-01-16,1,2019,"https://www.welt.de/wirtschaft/plus187145508/Kuenstliche-Intelligenz-Welche-Arbeitsplaetze-bleiben-noch-fuer-uns.html"
"744","Welt","Digitalisierung","Der demografische Wandel – Deutschlands mit Abstand größte Krise",2019-01-16,1,2019,"https://www.welt.de/debatte/kommentare/article187106520/GroKo-Die-Sozialpolitik-frisst-Deutschlands-Wohlstand-auf.html"
"745","Welt","Digitalisierung","Wie wir wieder lernen, unser Auto zu lieben",2019-01-21,1,2019,"https://www.welt.de/debatte/kommentare/plus187376390/Benziner-Diesel-Co-Wie-wir-wieder-lernen-unser-Auto-zu-lieben.html"
"746","Welt","Digitalisierung","Vor den Eliten diktiert Angela Merkel ihr Erbe",2019-01-23,1,2019,"https://www.welt.de/wirtschaft/article187589278/Davos-2019-Wie-Angela-Merkel-an-ihrem-Erbe-bastelt.html"
"747","Welt","Digitalisierung","Darum ist die Handschrift mehr als nur analoger Ausgleich",2019-01-23,1,2019,"https://www.welt.de/wissenschaft/video187585256/Merkfaehigkeit-Darum-ist-die-Handschrift-mehr-als-nur-analoger-Ausgleich.html"
"748","Welt","Digitalisierung","„Bei manchen Entwicklungen stehen wir nicht ganz an der Spitze“",2019-01-24,1,2019,"https://www.welt.de/politik/video187621860/AKK-zur-Digitalisierung-Bei-manchen-Entwicklungen-stehen-wir-nicht-ganz-an-der-Spitze.html"
"749","Welt","Digitalisierung","„Gut möglich, dass der Sieg der Märkte eine Ausnahme bleiben wird“",2019-01-27,1,2019,"https://www.welt.de/wirtschaft/plus187790870/Weltwirtschaftsgipfel-in-Davos-Das-Internet-gefaehrdet-die-Demokratie.html"
"750","Welt","Digitalisierung","„Das Scheitern des Digitalpakts ist nicht ausgeschlossen“",2019-01-29,1,2019,"https://www.welt.de/politik/deutschland/article187856096/WLAN-an-Schulen-Scheitern-des-Digitalpakts-ist-nicht-ausgeschlossen.html"
"751","Welt","Digitalisierung","Deutschland muss mutiger werden",2019-01-29,1,2019,"https://www.welt.de/wirtschaft/plus187820392/Kuenstliche-Intelligenz-Deutschland-muss-mutiger-werden.html"
"752","Welt","Digitalisierung","„Ein Vakuum an Regeln und Institutionen“",2019-01-31,1,2019,"https://www.welt.de/regionales/hamburg/article188033501/Digitale-Zukunft-Ein-Vakuum-an-Regeln-und-Institutionen.html"
"753","Welt","Digitalisierung","Das ist Deutschlands Antwort auf China und die USA",2019-02-01,2,2019,"https://www.welt.de/wirtschaft/article188065997/Marktwirtschaft-Wirtschaftsminister-Altmaier-stellt-neue-Strategie-vor.html"
"754","Welt","Digitalisierung","Die Globalisierung ändert ihr Gesicht",2019-02-03,2,2019,"https://www.welt.de/wirtschaft/article188175367/Globalisierung-Unternehmen-finden-neue-Strategien-fuer-Welthandel.html"
"755","Welt","Digitalisierung","Wir müssen raus aus den nationalen Filterblasen!",2019-02-08,2,2019,"https://www.welt.de/debatte/kommentare/article188402437/Johannes-Hillje-Wir-muessen-raus-aus-den-nationalen-Filterblasen.html"
"756","Welt","Digitalisierung","Die Grenzen künstlicher Intelligenz",2019-02-11,2,2019,"https://www.welt.de/wirtschaft/bilanz/article188571271/Maschinelles-Lernen-Die-Grenzen-kuenstlicher-Intelligenz.html"
"757","Welt","Digitalisierung","Digital Natives und die Suche der Kitas nach einer Antwort",2019-02-13,2,2019,"https://www.welt.de/regionales/nrw/article188685825/Digital-Natives-und-die-Suche-der-Kitas-nach-einer-Antwort.html"
"758","Welt","Digitalisierung","Kann Facebook Suizide verhindern?",2019-02-13,2,2019,"https://www.welt.de/gesundheit/article188741417/Facebook-Algorithmen-mit-KI-erkennen-Suizid-Gefahr.html"
"759","Welt","Digitalisierung","Meine Frage nach Brustschmerzen speichert Alexa sorgfältig ab",2019-02-15,2,2019,"https://www.welt.de/wirtschaft/webwelt/article188839843/Dr-Alexa-Amazon-Assistent-macht-nun-auf-Arzt.html"
"760","Welt","Digitalisierung","„Grand Theft Auto Ruckwarts Einparken“",2019-02-15,2,2019,"https://www.welt.de/debatte/kolumnen/zippert_zappt/article188857593/Zippert-zappt-Grand-Theft-Auto-Ruckwarts-Einparken.html"
"761","Welt","Digitalisierung","Drei Wege, wie Versicherungen digital werden können",2019-02-15,2,2019,"https://www.welt.de/wirtschaft/bilanz/article188857947/Digitalisierung-Versicherungen-laufen-Gefahr-den-Anschluss-zu-verpassen.html"
"762","Welt","Digitalisierung","Die Interventionswut des Staates lähmt die Wirtschaft",2019-02-17,2,2019,"https://www.welt.de/debatte/kommentare/article188934701/Juergen-Ruettgers-Wie-staatliche-Interventionen-die-Wirtschaft-laehmen.html"
"763","Welt","Digitalisierung","Angela Merkel spricht auf dem Digitising Europe Summit",2019-02-19,2,2019,"https://www.welt.de/wirtschaft/video189019221/Digitising-Europe-Summit-Angela-Merkels-Rede.html"
"764","Welt","Digitalisierung","„Bitte erwürgen Sie nicht jede Innovation von Beginn an“",2019-02-19,2,2019,"https://www.welt.de/wirtschaft/article189066831/Digitalisierung-Buerger-fuerchten-um-den-Standort-Deutschland.html"
"765","Welt","Digitalisierung","Abschied vom digitalen Firlefanz",2019-02-20,2,2019,"https://www.welt.de/wirtschaft/bilanz/article189085097/Ausblick-2019-Abschied-vom-digitalen-Firlefanz.html"
"766","Welt","Digitalisierung","Bund und Länder einigen sich bei Digitalpakt",2019-02-21,2,2019,"https://www.welt.de/politik/video189143383/Ueber-fuenf-Milliarden-Euro-Bund-und-Laender-einigen-sich-bei-Digitalpakt.html"
"767","Welt","Digitalisierung","Der große Fehler des Digitalpakts wird schon zu Beginn gemacht",2019-02-21,2,2019,"https://www.welt.de/wirtschaft/karriere/bildung/article189201263/Digitalpakt-fuer-Schulen-Schwaches-Konzept-fehlendes-Fachpersonal.html"
"768","Welt","Digitalisierung","Diese sechs Jobs sind in zehn Jahren gefragt",2019-02-22,2,2019,"https://www.welt.de/wirtschaft/karriere/plus189166949/Berufe-mit-Zukunft-Diese-sechs-Jobs-sind-in-zehn-Jahren-gefragt.html"
"769","Welt","Digitalisierung","Die Verblödung der Schüler ist vorangeschritten",2019-02-22,2,2019,"https://www.welt.de/debatte/kolumnen/zippert_zappt/article189255393/Zippert-zappt-Digitalisierung-fuer-verbloedete-Schueler.html"
"770","Welt","Digitalisierung","Generation kurzsichtig",2019-02-23,2,2019,"https://www.welt.de/wirtschaft/karriere/bildung/plus189238763/Kurzsichtigkeit-Wird-die-Generation-Z-zur-Generation-Brille.html"
"771","Welt","Digitalisierung","Die größten Herausforderungen für Deutschlands Schulen",2019-02-23,2,2019,"https://www.welt.de/wirtschaft/karriere/bildung/article189284285/Bildung-Deutsche-Schulen-brauchen-15-Milliarden-Euro-mehr.html"
"772","Welt","Digitalisierung","So surft es sich im schnellsten Internet Deutschlands",2019-02-24,2,2019,"https://www.welt.de/wirtschaft/webwelt/plus189314759/Schnelles-Internet-Wozu-man-ein-Gigabit-braucht.html"
"773","Welt","Digitalisierung","„Wenn wir stillstehen, wird es eine böse Überraschung geben“",2019-02-25,2,2019,"https://www.welt.de/wirtschaft/plus189291523/Bruno-Le-Maire-Wir-leben-in-einer-gewalttaetigen-Welt.html"
"774","Welt","Digitalisierung","Hamburg soll Zentrum für Blockchain werden",2019-02-26,2,2019,"https://www.welt.de/regionales/hamburg/article189443279/Verein-will-Hamburg-zum-Zentrum-fuer-Blockchain-Technologie-machen.html"
"775","Welt","Digitalisierung","Dr. Algorithmus",2019-02-26,2,2019,"https://www.welt.de/wirtschaft/bilanz/article189418949/Dr-Algorithmus-Kuenstliche-Intelligenz-in-der-Medizin.html"
"776","Welt","Digitalisierung","Deutschland verbaut sich seine digitale Zukunft",2019-02-27,2,2019,"https://www.welt.de/wirtschaft/bilanz/article189507645/Digitalisierung-und-KI-Deutschland-verbaut-sich-seine-digitale-Zukunft-eigenhaendig.html"
"777","Welt","Digitalisierung","Wir hinken hinterher",2019-02-27,2,2019,"https://www.welt.de/debatte/kommentare/plus189536781/Innovationspolitik-Deutschland-hinkt-hinterher.html"
"778","Welt","Digitalisierung","Können wir bald auch Gerüche mit unseren Freunden teilen?",2019-02-28,2,2019,"https://www.welt.de/wirtschaft/article189473185/Einkaufen-der-Zukunft-Experten-sehen-radikalen-Umbruch-im-Einzelhandel.html"
"779","Welt","Digitalisierung","„Möglichkeiten von KI sehen, nicht Risiken“",2019-02-28,2,2019,"https://www.welt.de/wirtschaft/bilanz/article189561535/KI-Experte-Moeglichkeiten-von-KI-sehen-nicht-Risiken.html"
"780","Welt","Digitalisierung","Unsere Marktwirtschaft braucht ein Öko-Update",2019-03-04,3,2019,"https://www.welt.de/debatte/kommentare/article189737693/Danyal-Bayaz-Unsere-Marktwirtschaft-braucht-ein-Oeko-Update.html"
"781","Welt","Digitalisierung","Für einen Neubeginn in Europa",2019-03-04,3,2019,"https://www.welt.de/debatte/kommentare/plus189751165/Emmanuel-Macron-Wir-Europaeer-muessen-uns-gegen-die-Nationalisten-zur-Wehr-setzen.html"
"782","Welt","Digitalisierung","Grünen-Denkfabrik fordert milliardenschwere neue Arbeitsversicherung",2019-03-05,3,2019,"https://www.welt.de/wirtschaft/article189789541/Automatisierung-Heinrich-Boell-Stiftung-fordert-Sozialversicherung-fuer-Weiterbildung.html"
"783","Welt","Digitalisierung","Doxing, Greyhats, Stuxnet – 10 Fragen über das Hacker-Leben",2019-03-06,3,2019,"https://www.welt.de/kmpkt/article189816645/Internet-Quiz-Doxing-Greyhats-Stuxnet-10-Fragen-ueber-das-Hacker-Leben.html"
"784","Welt","Digitalisierung","Mehr als nur die „alte Arbeit im Minirock“",2019-03-06,3,2019,"https://www.welt.de/regionales/hamburg/article189864375/Ein-Hamburger-lehrt-New-Work-Mehr-als-die-alte-Arbeit-im-Minirock.html"
"785","Welt","Digitalisierung","Mehrheit der Fachkräfte sieht der Digitalisierung gelassen entgegen",2019-03-07,3,2019,"https://www.welt.de/wirtschaft/karriere/video181955504/Wandel-im-Arbeitsmarkt-Mehrheit-der-Fachkraefte-sieht-der-Digitalisierung-gelassen-entgegen.html"
"786","Welt","Digitalisierung","Informatik muss zum Schulfach werden",2019-03-08,3,2019,"https://www.welt.de/wirtschaft/bilanz/article189970533/Neuer-Digitalpakt-Informatik-muss-zum-Schulfach-werden.html"
"787","Welt","Digitalisierung","„Mit voller Hose gewinnen Sie keinen 100-Meter-Lauf“",2019-03-08,3,2019,"https://www.welt.de/wirtschaft/plus189917575/Wir-leiden-an-einer-postmaterialistischen-Selbstverwirklichungspsychose.html"
"788","Welt","Digitalisierung","Verkehrsminister Scheuer stellt Flugtaxi von Airbus vor",2019-03-11,3,2019,"https://www.welt.de/wirtschaft/video190095807/CityAirbus-Andreas-Scheuer-stellt-Flugtaxi-von-Airbus-in-Ingolstadt-vor.html"
"789","Welt","Digitalisierung","Die deutschen Lehrer fühlen sich digital abgehängt",2019-03-12,3,2019,"https://www.welt.de/wirtschaft/karriere/bildung/article190150363/Digitalpakt-Deutsche-Lehrer-sehen-sich-digital-abgehaengt.html"
"790","Welt","Digitalisierung","In Afrika kommen eilige Medikamente mit der Drohne",2019-03-12,3,2019,"https://www.welt.de/regionales/nrw/article190183809/In-Afrika-kommen-eilige-Medikamente-mit-der-Drohne.html"
"791","Welt","Digitalisierung","„Habe nichts gegen die 32-Stunden-Woche mit Lohnausgleich“",2019-03-13,3,2019,"https://www.welt.de/politik/deutschland/plus190238205/Franz-Muentefering-Ex-SPD-Chef-offen-fuer-neue-Arbeitsmodelle.html"
"792","Welt","Digitalisierung","Satt, selbstzufrieden und träge",2019-03-13,3,2019,"https://www.welt.de/debatte/kommentare/plus190257311/Sebastian-Kurz-EU-wirkt-satt-selbstzufrieden-und-traege.html"
"793","Welt","Digitalisierung","Wenn Schüler den Lehrern erklären müssen, was überhaupt eine Cloud ist",2019-03-14,3,2019,"https://www.welt.de/politik/deutschland/article190289529/Was-ein-Schuelervertreter-ueber-den-Digitalpakt-denkt.html"
"794","Welt","Digitalisierung","Die Kritik am neuen Thermomix ist absurd",2019-03-14,3,2019,"https://www.welt.de/debatte/kommentare/article190236899/Thermomix-TM6-von-Vorwerk-Die-Kritik-am-neuen-Modell-ist-absurd.html"
"795","Welt","Digitalisierung","Die Ministerin, die sich wegduckt",2019-03-16,3,2019,"https://www.welt.de/politik/deutschland/plus190365865/Anja-Karliczek-CDU-Die-Ministerin-die-sich-wegduckt.html"
"796","Welt","Digitalisierung","Für den Fingerabdruck der Zukunft schauen Kameras uns unter die Haut",2019-03-17,3,2019,"https://www.welt.de/wirtschaft/article190425041/So-leben-wir-morgen-Super-Rechner-und-andere-Zukunftstrends.html"
"797","Welt","Digitalisierung","Wer nicht lesen kann, kann auch kein Mathe",2019-03-18,3,2019,"https://www.welt.de/regionales/nrw/article190367947/Grundschueler-Wer-nicht-lesen-kann-kann-auch-kein-Mathe.html"
"798","Welt","Digitalisierung","Schnelles WLAN für alle Klassenzimmer",2019-03-18,3,2019,"https://www.welt.de/regionales/hamburg/article190476305/Digitalisierung-Schnelles-WLAN-fuer-alle-Klassenzimmer.html"
"799","Welt","Digitalisierung","Woodstock für die Gestalter der Zukunft",2019-03-20,3,2019,"https://www.welt.de/wirtschaft/bilanz/article190561507/SXSW-Woodstock-fuer-die-Gestalter-der-Zukunft.html"
"800","Welt","Digitalisierung","Sie wollen Freiheit, doch sie marschieren für die Stärkeren",2019-03-25,3,2019,"https://www.welt.de/debatte/kommentare/article190782385/Urheberrecht-Sie-wollen-Freiheit-aber-marschieren-fuer-die-Staerkeren.html"
"801","Welt","Digitalisierung","Lebensmittel-Verschwendung soll bis 2030 auf Null sinken",2019-03-27,3,2019,"https://www.welt.de/wirtschaft/article190894189/Kuenstliche-Intelligenz-soll-Lebensmittel-Verschwendung-auf-Null-reduzieren.html"
"802","Welt","Digitalisierung","Bitte nicht auch noch einen Techxit!",2019-03-27,3,2019,"https://www.welt.de/debatte/kommentare/article190921169/Big-Data-Bitte-nicht-auch-noch-einen-Techxit.html"
"803","Welt","Digitalisierung","Viele Digitalberater machen noch keinen digitalen Champion",2019-03-28,3,2019,"https://www.welt.de/debatte/kommentare/plus191007571/Digitalrat-Viele-Berater-machen-noch-keinen-Champion.html"
"804","Welt","Digitalisierung","„Fast überall gehen tiefe Risse durch die Gesellschaft“",2019-03-30,3,2019,"https://www.welt.de/wirtschaft/article191071965/Sick-Chef-fordert-Manager-zu-mehr-politischer-Einmischung-auf.html"
"805","Welt","Digitalisierung","Warum ist „Alien Glamour“ gerade so angesagt?",2019-03-30,3,2019,"https://www.welt.de/iconist/beauty/article190876215/Body-Modification-Der-Anti-Beauty-Trend-passt-zum-Zeitgeist.html"
"806","Welt","Digitalisierung","Amazons Alexa, die Stasi-Kiste im Wohnzimmer",2019-03-31,3,2019,"https://www.welt.de/debatte/kommentare/article191120613/Amazons-Alexa-Die-Stasi-Kiste-im-Wohnzimmer.html"
"807","Welt","Digitalisierung","Für Versicherungen bleibt nur die Flucht nach vorn",2019-04-04,4,2019,"https://www.welt.de/wirtschaft/bilanz/article191312257/Digitalisierung-Fuer-Versicherungen-bleibt-nur-die-Flucht-nach-vorn.html"
"808","Welt","Digitalisierung","So sollen die Roboterautos wirklich sicher werden",2019-04-06,4,2019,"https://www.welt.de/wirtschaft/article191452299/US-Firma-will-ferngesteuerte-Pkw-nach-Deutschland-bringen.html"
"809","Welt","Digitalisierung","Diese Technik ersetzt den Unfallgutachter",2019-04-07,4,2019,"https://www.welt.de/wirtschaft/article191476411/TUEV-Sued-Kuenstliche-Intelligenz-ersetzt-Unfallgutachter.html"
"810","Welt","Digitalisierung","„Wir brauchen in der Industriepolitik eine gesamteuropäische Denke“",2019-04-07,4,2019,"https://www.welt.de/wirtschaft/video191506971/Guenther-Oettinger-ueber-kuenstliche-Intelligenz-5G-und-europaeische-Unternehmen.html"
"811","Welt","Digitalisierung","„Mit dem Brexit macht die EU andere stark – und China ist der größte Gewinner“",2019-04-08,4,2019,"https://www.welt.de/wirtschaft/article191506095/Brexit-Chaos-EU-Kommissar-Guenther-Oettinger-sieht-China-als-Gewinner.html"
"812","Welt","Digitalisierung","Leistung geht vor Sozialleistung!",2019-04-08,4,2019,"https://www.welt.de/debatte/kommentare/plus191470361/Mario-Ohoven-Leistung-geht-vor-Sozialleistung.html"
"813","Welt","Digitalisierung","Wie Algorithmen die Welt verbessern",2019-04-08,4,2019,"https://www.welt.de/debatte/kommentare/article191528781/Digitalisierung-Wie-Algorithmen-die-Welt-verbessern.html"
"814","Welt","Digitalisierung","Eigentum ist die DNA unserer Kultur",2019-04-09,4,2019,"https://www.welt.de/debatte/kommentare/article177273768/10-Thesen-Eigentum-ist-die-DNA-unserer-Kultur.html"
"815","Welt","Digitalisierung","Wann kommt der Perso fürs Netz?",2019-04-09,4,2019,"https://www.welt.de/wirtschaft/bilanz/article191577539/Digitale-Identitaeten-viele-Ansaetze-keine-Loesung.html"
"816","Welt","Digitalisierung","Der neue Airbus-Chef schließt Flugzeuge mit Wasserstoffantrieb nicht aus",2019-04-09,4,2019,"https://www.welt.de/wirtschaft/article191577843/Airbus-Neuer-Chef-Guillaume-Faury-will-den-Konzern-gruener-machen.html"
"817","Welt","Digitalisierung","„Kinder bekommen Handkrämpfe bei längeren Aufsätzen“",2019-04-09,4,2019,"https://www.welt.de/wirtschaft/karriere/bildung/article191585215/Handschrift-So-schlecht-sind-deutsche-Schueler.html"
"818","Welt","Digitalisierung","Baumaschinen-Hersteller entdecken Elektromobilität",2019-04-09,4,2019,"https://www.welt.de/wirtschaft/article191577191/Baumaschinen-Hersteller-entdecken-die-Elektromobilitaet.html"
"819","Welt","Digitalisierung","Lehrer bemängeln Schreibfähigkeiten ihrer Schüler",2019-04-09,4,2019,"https://www.welt.de/wirtschaft/karriere/video191595543/Krickelkrakel-Lehrer-bemaengeln-Schreibfaehigkeiten-ihrer-Schueler.html"
"820","Welt","Digitalisierung","Tschüssi, Glotze! Wir hatten eine gute Zeit",2019-04-10,4,2019,"https://www.welt.de/iconist/partnerschaft/article191534711/Lineares-Fernsehen-Wer-braucht-heute-eigentlich-noch-ein-Fernseher.html"
