"","outlet","category","title","date","month","year","url"
"1049","Welt","Digitalisierung","„Deutschland muss im Zweifel großzügig sein“",2020-04-21,4,2020,"https://www.welt.de/wirtschaft/article207381275/Bain-Company-Deutschland-muss-in-der-Krise-Vorreiter-sein.html"
"1050","Welt","Digitalisierung","„Meine Regel: Ich darf nicht denselben Fehler zweimal machen“",2020-04-22,4,2020,"https://www.welt.de/kultur/medien/plus206892247/Fliegende-Autos-neues-Denken-Tech-Star-Sebastian-Thrun-im-Interview.html"
"1051","Welt","Digitalisierung","Liebe Lehrer, euer Versagen ist unser Untergang",2020-04-23,4,2020,"https://www.welt.de/wirtschaft/plus207461201/Homeschooling-Der-Fernunterricht-muss-her-und-zwar-sofort.html"
"1052","Welt","Digitalisierung","Gilt für Medien in der Corona-Krise das Darwin-Prinzip?",2020-04-24,4,2020,"https://www.welt.de/kultur/medien/article207472865/Frank-Lobigs-ueber-Corona-und-die-Digitalisierung-der-Medien.html"
"1053","Welt","Digitalisierung","Jetzt zeigt sich die mangelnde Digitalisierung der Behörden",2020-04-25,4,2020,"https://www.welt.de/wirtschaft/video207507839/Ausgesetzte-Strafbefehle-Jetzt-zeigt-sich-die-mangelnde-Digitalisierung-der-Behoerden.html"
"1054","Welt","Digitalisierung","Das Corona-Paradies für Kriminelle",2020-04-25,4,2020,"https://www.welt.de/wirtschaft/article207481187/Ausgesetzte-Strafbefehle-Das-Corona-Paradies-fuer-Kriminelle.html"
"1055","Welt","Digitalisierung","Erboste Lehrer, frustrierte Eltern – dieser Streit offenbart eine tiefe Kluft",2020-04-27,4,2020,"https://www.welt.de/wirtschaft/karriere/bildung/plus207529799/Homeschooling-So-wehren-sich-die-Lehrer-gegen-die-Kritik-der-WELT-Autoren.html"
"1056","Welt","Digitalisierung","So will die Hamburger Polizei raus aus der digitalen Steinzeit",2020-04-28,4,2020,"https://www.welt.de/regionales/hamburg/article207539511/Digitalisierung-So-will-die-Hamburger-Polizei-raus-aus-der-digitalen-Steinzeit.html"
"1057","Welt","Digitalisierung","Auch in der Krise muss investiert werden",2020-04-28,4,2020,"https://www.welt.de/debatte/kommentare/article207593071/Wirtschaft-Auch-in-der-Krise-muss-investiert-werden.html"
"1058","Welt","Digitalisierung","Die Fehler von 2009 dürfen sich jetzt nicht wiederholen",2020-04-30,4,2020,"https://www.welt.de/wirtschaft/article207568667/Gewerkschaften-So-nutzen-wir-die-Chancen-der-Krise.html"
"1059","Welt","Digitalisierung","„Ich schalte jetzt per Zufall eure Mikros an“",2020-05-01,5,2020,"https://www.welt.de/wirtschaft/karriere/bildung/article207658803/Hochschulen-in-der-Coronakrise-Die-Zwangs-Digitalisierung-der-Universitaet.html"
"1060","Welt","Digitalisierung","Plötzlich schafft Deutschland, was bisher unmöglich schien",2020-05-02,5,2020,"https://www.welt.de/wirtschaft/article207541717/Digitalisierung-Mit-Corona-schafft-Deutschland-das-bisher-Unmoegliche.html"
"1061","Welt","Digitalisierung","Grüne halten Parteitag erstmals komplett im Internet ab",2020-05-03,5,2020,"https://www.welt.de/politik/deutschland/video207693347/Wege-aus-Corona-Krise-Gruene-halten-Parteitag-erstmals-komplett-im-Internet-ab.html"
"1062","Welt","Digitalisierung","„Datenschutz hat häuﬁg eine Sündenbockfunktion“",2020-05-04,5,2020,"https://www.welt.de/regionales/hamburg/plus207643957/Corona-App-Datenschutz-hat-haeu-g-eine-Suendenbockfunktion.html"
"1063","Welt","Digitalisierung","So motivieren Sie Ihr Kind zum Lesen",2020-05-09,5,2020,"https://www.welt.de/wirtschaft/karriere/plus207838827/Homeschooling-So-motivieren-Sie-Ihr-Kind-zum-Lesen.html"
"1064","Welt","Digitalisierung","Wer haftet bei Unfall oder Sachschaden im heimischen Büro?",2020-05-11,5,2020,"https://www.welt.de/sonderthemen/article207903327/Rechte-und-Pflichten-im-Homeoffice.html"
"1065","Welt","Digitalisierung","Ein Kleid für 8700 Euro – doch es existiert nur virtuell",2020-05-13,5,2020,"https://www.welt.de/iconist/mode/article207896541/Virtuelle-Mode-fuer-eine-Gesellschaft-die-zunehmend-im-Netz-lebt.html"
"1066","Welt","Digitalisierung","„Das Onlinesemester läuft bemerkenswert gut“",2020-05-13,5,2020,"https://www.welt.de/regionales/nrw/article207952735/NRW-Wissenschaftsministerin-Isabel-Pfeiffer-Poensgen-ueber-die-Handhabung-der-Lehre-an-Universitaeten.html"
"1067","Welt","Digitalisierung","500 Millionen Euro für Laptops und Tablets für Schüler",2020-05-15,5,2020,"https://www.welt.de/politik/video208017245/Digitalisierung-500-Millionen-Euro-fuer-Laptops-und-Tablets-fuer-Schueler.html"
"1068","Welt","Digitalisierung","„In Skandinavien blieb der Umsatz erhalten, weil der Unterricht digitalisiert war“",2020-05-16,5,2020,"https://www.welt.de/wirtschaft/karriere/article207999291/Berlitz-Sprachschulen-In-Skandinavien-blieb-der-Umsatz-erhalten-weil-der-Unterricht-digitalisiert-war.html"
"1069","Welt","Digitalisierung","Zu wenige Fachlehrer, kümmerliche Digitalisierung",2020-05-18,5,2020,"https://www.welt.de/regionales/nrw/article208059057/NRW-Studie-Zu-wenige-Fachlehrer-kuemmerliche-Digitalisierung.html"
"1070","Welt","Digitalisierung","Das allererste Mal – digital",2020-05-18,5,2020,"https://www.welt.de/vermischtes/video208071697/Digitalisierung-in-der-Corona-Krise-Zum-allerersten-Mal-digital.html"
"1071","Welt","Digitalisierung","Stresstest für Unternehmer und ganze Branchen",2020-05-18,5,2020,"https://www.welt.de/sonderthemen/article208073087/Gewinner-und-Verlierer-der-Krise.html"
"1072","Welt","Digitalisierung","Wir werden mit großer Stärke aus dieser Krise herausgehen",2020-05-19,5,2020,"https://www.welt.de/wirtschaft/mittelstand/article208079731/Strategien-des-Mittelstandes.html"
"1073","Welt","Digitalisierung","Hohe Schulden und steigende Zinsen – so kann das Unmögliche gelingen",2020-05-29,5,2020,"https://www.welt.de/wirtschaft/article208506869/Per-Blockchain-gegen-Corona-Die-digitale-Geldschmelze-loest-das-Zins-Dilemma.html"
"1074","Welt","Digitalisierung","So sicher fühlen Fachkräfte sich vor der Jobvernichtung",2020-05-31,5,2020,"https://www.welt.de/wirtschaft/karriere/article208639587/Umfrage-Nicht-Akademiker-sehen-Digitalisierung-als-Chance.html"
"1075","Welt","Digitalisierung","„Project AI“ – so weit ist BMW beim Auto der Zukunft",2020-06-01,6,2020,"https://www.welt.de/wirtschaft/plus208685857/BMW-Project-AI-Fortschritte-beim-Auto-der-Zukunft.html"
"1076","Welt","Digitalisierung","„Zur Not zahlen wir die Schulden mit Beiträgen der Mitgliedsländer zurück“",2020-06-02,6,2020,"https://www.welt.de/wirtschaft/article208724513/EU-Vizepraesident-Dombrovskis-Ohne-Reformen-fliesst-auch-kein-Geld.html"
"1077","Welt","Digitalisierung","Der Bayern-Plan soll Deutschlands Wirtschaft retten",2020-06-02,6,2020,"https://www.welt.de/wirtschaft/article208729499/Neustart-der-Wirtschaft-Zukunftsrat-legt-Pandemie-Plaene-fuer-deutsche-Industrie-vor.html"
"1078","Welt","Digitalisierung","„Ich hätte meine Kollegen nicht zwingen können, sich von außen zuzuschalten“",2020-06-02,6,2020,"https://www.welt.de/politik/deutschland/article208656321/Digitalisierung-der-Schulen-Wenn-Glueck-der-entscheidende-Faktor-ist.html"
"1079","Welt","Digitalisierung","Jetzt schlägt die Stunde der KI-Autodidakten",2020-06-02,6,2020,"https://www.welt.de/wirtschaft/plus208706583/Kuenstliche-Intelligenz-Die-Stunde-der-Autodidakten.html"
"1080","Welt","Digitalisierung","Chinas Patent-Flut lässt Deutschland alt aussehen",2020-06-05,6,2020,"https://www.welt.de/wirtschaft/plus208873195/Innovationskraft-Deutschland-verliert-seine-Zukunftsfaehigkeit.html"
"1081","Welt","Digitalisierung","Dieses Bündnis will Deutschlands Mittelstand digitalisieren",2020-06-06,6,2020,"https://www.welt.de/wirtschaft/article209066483/Mittelstand-Neue-Plattform-soll-bei-Digitalisierung-helfen.html"
"1082","Welt","Digitalisierung","Ein Wumms mit Langzeitwirkung",2020-06-07,6,2020,"https://www.welt.de/politik/deutschland/article209111055/Konjunkturprogramm-Ein-Wumms-mit-Langzeitwirkung.html"
"1083","Welt","Digitalisierung","„Wir sollten einen Homeschooling-Tag beibehalten“",2020-06-08,6,2020,"https://www.welt.de/politik/deutschland/article209156411/Schule-der-Zukunft-Wir-sollten-einen-Homeschooling-Tag-beibehalten.html"
"1084","Welt","Digitalisierung","Israels unsichtbarer Krieg",2020-06-10,6,2020,"https://www.welt.de/politik/ausland/plus209295547/Cyberspace-Israels-unsichtbarer-Krieg.html"
"1085","Welt","Digitalisierung","Diese Berufe kennen keine Krise",2020-06-11,6,2020,"https://www.welt.de/wirtschaft/karriere/article209344585/Hier-werden-selbst-jetzt-haenderingend-Mitarbeiter-gesucht.html"
"1086","Welt","Digitalisierung","In der Fabrik der Zukunft sind nur noch Boden, Wände und Decke fest",2020-06-13,6,2020,"https://www.welt.de/wirtschaft/article209482163/Digitalisierung-Corona-Krise-zeigt-der-Industrie-den-Weg.html"
"1087","Welt","Digitalisierung","Kanzleramtschef Braun gesteht Versäumnis bei Corona-App ein",2020-06-14,6,2020,"https://www.welt.de/politik/deutschland/article209513869/Kontaktnachverfolgung-Kanzleramtschef-Braun-gesteht-Versaeumnis-bei-Corona-App-ein.html"
"1088","Welt","Digitalisierung","Volkswagen investiert Milliarden in eigene Software-Produktion",2020-06-14,6,2020,"https://www.welt.de/wirtschaft/article209500621/Volkswagen-Milliarden-fuer-eigene-Software-Produktion.html"
"1089","Welt","Digitalisierung","„In fünf Jahren haben wir diese Menschen verloren“",2020-06-14,6,2020,"https://www.welt.de/politik/deutschland/article209530783/Corona-App-In-fuenf-Jahren-haben-wir-diese-Menschen-verloren.html"
"1090","Welt","Digitalisierung","Wir sollten vor allem mündig mit der Corona-App umgehen",2020-06-16,6,2020,"https://www.welt.de/kultur/plus209463513/Die-Corona-App-sinnvoll-oder-ein-Instrument-der-Unterdrueckung.html"
"1091","Welt","Digitalisierung","Restaurants ohne Sitzplätze und Küche – die Zukunft der Gastronomie?",2020-06-16,6,2020,"https://www.welt.de/wirtschaft/article209680543/Wann-sich-der-Lieferservice-fuer-Gastronomen-lohnt.html"
"1092","Welt","Digitalisierung","Zwang, Druck, Frust – Schüler verlieren die Lust",2020-06-18,6,2020,"https://www.welt.de/debatte/kommentare/article209761289/Bildung-Zwang-Druck-Frust-Schueler-verlieren-die-Lust.html"
"1093","Welt","Digitalisierung","Das sagt Volkswagens Software-Chef über die digitale Jagd auf Tesla",2020-06-18,6,2020,"https://www.welt.de/wirtschaft/article209506747/Volkswagen-Wie-VW-den-Rueckstand-zu-Tesla-aufholen-will.html"
"1094","Welt","Digitalisierung","Der Bürger wird zum „moving target“",2020-06-20,6,2020,"https://www.welt.de/kultur/plus209755503/Corona-Warn-App-Der-Buerger-wird-zum-moving-target.html"
"1095","Welt","Digitalisierung","Die letzten Jahrzehnte haben wir es übertrieben",2020-06-21,6,2020,"https://www.welt.de/debatte/kommentare/plus209982601/Globalisierung-Die-letzten-Jahrzehnte-haben-wir-es-uebertrieben.html"
"1096","Welt","Digitalisierung","„Können nicht alle besser sein als der Durchschnitt“",2020-06-23,6,2020,"https://www.welt.de/politik/deutschland/article210132969/Bildungsbericht-Koennen-nicht-alle-besser-sein-als-der-Durchschnitt.html"
"1097","Welt","Digitalisierung","Brauchen wir auch ein „Recht auf Büro“?",2020-06-25,6,2020,"https://www.welt.de/podcasts/gegen-den-corona-koller/article210218939/Podcast-Homeoffice-und-Digitalisierung-nach-drei-Monaten-Corona.html"
"1098","Welt","Digitalisierung","Microsoft lernt jetzt Millionen für die nachgefragtesten Jobs an",2020-06-30,6,2020,"https://www.welt.de/wirtschaft/article210739995/Microsoft-will-Millionen-Menschen-bei-der-Jobsuche-helfen.html"
"1099","Welt","Digitalisierung","„Krasse Hilflosigkeit“",2020-07-02,7,2020,"https://www.welt.de/politik/deutschland/plus210605283/Uni-in-Corona-Zeiten-Campus-der-Vergessenen.html"
"1100","Welt","Digitalisierung","Scholz „Wümmschen“ bringt uns kein stabiles Wachstum",2020-07-03,7,2020,"https://www.welt.de/wirtschaft/article210843399/Coronahilfen-Warum-Scholz-Bazooka-nur-ein-Wuemmschen-ist.html"
"1101","Welt","Digitalisierung","Harvard ohne Campus? Der langsame Tod eines amerikanischen Traums",2020-07-08,7,2020,"https://www.welt.de/politik/ausland/plus211251743/USA-Harvard-ohne-Campus-Der-langsame-Tod-eines-amerikanischen-Traums.html"
"1102","Welt","Digitalisierung","STRG+ALT+ENTF",2020-07-10,7,2020,"https://www.welt.de/kultur/plus211310909/Die-Geburt-der-Cancel-Culture-aus-dem-Geist-des-Valley.html"
"1103","Welt","Digitalisierung","In Hamburg wird die Zukunft der Mobilität getestet",2020-07-15,7,2020,"https://www.welt.de/regionales/hamburg/article211669813/Von-Apps-bis-Logistikloesungen-In-Hamburg-wird-die-Zukunft-der-Mobilitaet-getestet.html"
"1104","Welt","Digitalisierung","Kollektive Blindheit im Wirecard-Wahn",2020-07-17,7,2020,"https://www.welt.de/wirtschaft/article211823295/Wirecard-Die-Suche-nach-den-Schuldigen-reicht-nicht.html"
"1105","Welt","Digitalisierung","Reich werden mit den drei Megatrends der Post-Corona-Ära",2020-07-17,7,2020,"https://www.welt.de/finanzen/plus211703771/Geldanlage-So-investieren-Sie-in-die-drei-Trends-der-Zukunft.html"
"1106","Welt","Digitalisierung","Nur ein Schulterschluss des Westens kann Chinas Aufstieg bremsen",2020-07-18,7,2020,"https://www.welt.de/wirtschaft/article211464219/Aufstieg-zur-Weltmacht-Nur-ein-Schulterschluss-des-Westens-kann-Chinas-Aufstieg-bremsen.html"
"1107","Welt","Digitalisierung","„Gerade im Mittelstand passiert einfach zu wenig“",2020-07-18,7,2020,"https://www.welt.de/wirtschaft/mittelstand/article211819441/Digitalisierung-Gerade-im-Mittelstand-passiert-einfach-zu-wenig.html"
"1108","Welt","Digitalisierung","Tausende Professoren, Stundenpläne und Hörsäle – das braucht keiner mehr",2020-07-20,7,2020,"https://www.welt.de/wirtschaft/karriere/bildung/article211886035/Digitales-Studium-Corona-erwirkt-das-Ende-der-Massenuniversitaet.html"
"1109","Welt","Digitalisierung","„Alle Prognosen übertroffen“ – trotzdem steckt Continental tief in der Krise",2020-07-21,7,2020,"https://www.welt.de/wirtschaft/article212005709/Quartalszahlen-Continental-quaelt-sich-in-die-Zukunft.html"
"1110","Welt","Digitalisierung","Diese sechs großen Stärken verschaffen Europa einen Wettbewerbsvorteil",2020-07-25,7,2020,"https://www.welt.de/wirtschaft/article212167127/Digitalisierung-Corona-zeigt-die-grossen-Staerken-Europas.html"
"1111","Welt","Digitalisierung","„In Deutschland ist eine große Dynamik entfacht worden“",2020-07-25,7,2020,"https://www.welt.de/wirtschaft/article212167401/Digitale-Medizin-Die-Dynamik-in-Deutschland-ist-gross.html"
"1112","Welt","Digitalisierung","Kreative und motivierte Lehrer? „Für die Eltern ist das ein Glücksspiel“",2020-08-01,8,2020,"https://www.welt.de/wirtschaft/karriere/bildung/article212534437/Digitale-Schule-Entscheidend-ist-der-Wohnort.html"
"1113","Welt","Digitalisierung","Die Mär vom deutschen Schulversagen",2020-08-05,8,2020,"https://www.welt.de/kultur/plus212828484/Corona-Die-Maer-vom-deutschen-Schulversagen.html"
"1114","Welt","Digitalisierung","100 Prozent Unterricht – sonst droht eine Bildungskatastrophe",2020-08-06,8,2020,"https://www.welt.de/debatte/kommentare/article213016078/Schule-Unterricht-muss-trotz-Corona-in-vollem-Umfang-stattfinden.html"
"1115","Welt","Digitalisierung","Jeden Tag schenken wir dem Chef fast eine Stunde Freizeit",2020-08-07,8,2020,"https://www.welt.de/wirtschaft/karriere/article213032388/Arbeitsalltag-in-Corona-Zeiten-Mehr-Meetings-laenger-im-Dienst.html"
"1116","Welt","Digitalisierung","Für die virenfreien Gefängnisse zahlt Deutschland einen hohen Preis",2020-08-08,8,2020,"https://www.welt.de/wirtschaft/plus213108582/Fuer-die-virenfreien-Gefaengnisse-zahlt-Deutschland-einen-hohen-Preis.html"
"1117","Welt","Digitalisierung","Digitaler Unterricht in NRW – Ein Laptop für 30 Schüler",2020-08-11,8,2020,"https://www.welt.de/regionales/nrw/article213299020/Digitaler-Unterricht-in-NRW-Ein-Laptop-fuer-30-Schueler.html"
"1118","Welt","Digitalisierung","SPD-Chefin Saskia Esken zu den finanziellen Hilfen für Schulen",2020-08-14,8,2020,"https://www.welt.de/videos/video213536104/Digitalisierung-SPD-Chefin-Saskia-Esken-zu-den-finanziellen-Hilfen-fuer-Schulen.html"
"1119","Welt","Digitalisierung","500-Millionen-Euro-Paket soll Digitalisierung an Schulen vorantreiben",2020-08-14,8,2020,"https://www.welt.de/politik/deutschland/video213539812/Corona-Massnahmen-500-Millionen-Euro-Paket-soll-Digitalisierung-an-Schulen-vorantreiben.html"
"1120","Welt","Digitalisierung","Computer-Kenntnisse für Arbeitnehmer ein Muss",2020-08-17,8,2020,"https://www.welt.de/wirtschaft/video213696622/Computer-Kenntnisse-sind-fuer-Arbeitnehmer-ein-Muss.html"
"1121","Welt","Digitalisierung","„Größte Herausforderung sind nicht die Patienten, sondern die Ärzte“",2020-08-18,8,2020,"https://www.welt.de/politik/deutschland/article213718788/Digitale-Sprechstunde-Groesste-Herausforderung-sind-nicht-Patienten-sondern-die-Aerzte.html"
"1122","Welt","Digitalisierung","Woran Deutschland scheitert, ist im Baltikum seit Jahren Normalität",2020-08-21,8,2020,"https://www.welt.de/wirtschaft/plus213983516/Vorbild-Baltikum-Die-Corona-Pandemie-offenbart-Deutschlands-digitale-Rueckstaendigkeit.html"
"1123","Welt","Digitalisierung","Goldgrube Corona-Test – Jetzt geht Dubai „aggressiv in den Wettbewerb“",2020-08-21,8,2020,"https://www.welt.de/wirtschaft/plus214057640/Goldgrube-Corona-Test-Darum-bricht-jetzt-ein-aggressiver-Wettbewerb-aus.html"
"1124","Welt","Digitalisierung","Was diese Ärzte aus ihrem lukrativen Job treibt",2020-08-24,8,2020,"https://www.welt.de/wirtschaft/karriere/plus214129452/Start-ups-Warum-aus-Aerzten-Doctorpreneurs-werden.html"
"1125","Welt","Digitalisierung","Die FDP muss mutiger werden",2020-08-24,8,2020,"https://www.welt.de/debatte/kommentare/article213445248/Liberale-Die-FDP-muss-mutiger-werden.html"
"1126","Welt","Digitalisierung","„Klima-Killer“ mit Helden-Status – die neue S-Klasse muss Daimler retten",2020-08-24,8,2020,"https://www.welt.de/wirtschaft/plus214179504/S-Klasse-W223-Dieser-Mercedes-muss-Daimler-retten.html"
"1127","Welt","Digitalisierung","Wie der Schweizer Rundfunk mit weniger Geld viel mehr erreichen will",2020-08-25,8,2020,"https://www.welt.de/kultur/medien/plus214221628/Oeffentlich-rechtliche-Medien-In-der-Schweiz-wird-umgebaut.html"
"1128","Welt","Digitalisierung","Milliarden für Schul-Digitalisierung bisher nicht ausgegeben",2020-08-30,8,2020,"https://www.welt.de/politik/deutschland/article214634514/Schul-Digitalisierung-Knapp-fuenf-Milliarden-bisher-nicht-ausgegeben.html"
"1129","Welt","Digitalisierung","Dieser Musiklehrer schaffte das, woran Schulen scheiterten",2020-08-30,8,2020,"https://www.welt.de/wirtschaft/article214672978/Way-of-Music-An-Musikschule-gingen-Schueler-in-die-Online-Lehre.html"
"1130","Welt","Digitalisierung","„Als Corona kam, ist der Laden zusammengebrochen“",2020-08-31,8,2020,"https://www.welt.de/regionales/hamburg/article214693796/Gesundheitsaemter-Als-Corona-kam-ist-der-Laden-zusammengebrochen.html"
"1131","Welt","Digitalisierung","Kernabitur und Zentralismus – Dieses Schulsystem wollen die Deutschen wirklich",2020-09-02,9,2020,"https://www.welt.de/wirtschaft/article214839522/Ifo-Umfrage-zu-Bildungspolitik-Deutsche-wollen-mehr-Zentralismus.html"
"1132","Welt","Digitalisierung","Dies ist das Zeitalter des Abstands, und Elon Musk ist sein Prophet",2020-09-04,9,2020,"https://www.welt.de/kultur/plus214875758/Slavoj-Zizek-Das-Zeitalter-des-Abstands-und-Elon-Musk-sein-Prophet.html"
"1133","Welt","Digitalisierung","Mit der Pandemie leben? Nein, wir müssen sie digital bekämpfen!",2020-09-06,9,2020,"https://www.welt.de/wirtschaft/webwelt/article215149058/KI-Pionier-Boos-Corona-Pandemie-mit-Digitalisierung-bekaemfepn.html"
"1134","Welt","Digitalisierung","Europas führender Gelddrucker wappnet sich für die Ära des Parallel-Euro",2020-09-08,9,2020,"https://www.welt.de/wirtschaft/plus215213492/Giesecke-Devrient-Europas-fuehrender-Gelddrucker-plant-den-Digital-Euro.html"
"1135","Welt","Digitalisierung","Der wichtigste Faktor beim digitalen Lernen ist die richtige Technik",2020-09-08,9,2020,"https://www.welt.de/wirtschaft/webwelt/article215243680/Digitales-Lernen-Darauf-kommt-es-beim-Unterricht-zu-Hause-an.html"
"1136","Welt","Digitalisierung","„Es wird gängiger werden, seinen Gesundheitsstatus nachweisen zu müssen“",2020-09-08,9,2020,"https://www.welt.de/politik/deutschland/article215241168/Digitaler-Impfausweis-Papierdokumente-kann-man-leicht-faelschen.html"
"1137","Welt","Digitalisierung","Deutschland will Weltmeister im automatisierten Fahren werden",2020-09-09,9,2020,"https://www.welt.de/videos/video215398008/Autogipfel-in-Berlin-Deutschland-will-Weltmeister-im-automatisierten-Fahren-werden.html"
"1138","Welt","Digitalisierung","Redaktion der „Süddeutschen Zeitung“ fürchtet Stellenabbau",2020-09-14,9,2020,"https://www.welt.de/wirtschaft/article215713834/Redaktion-der-Sueddeutschen-Zeitung-fuerchtet-Jobabbau.html"
"1139","Welt","Digitalisierung","Fünf Ideen, die Deutschland zukunftsfest machen",2020-09-15,9,2020,"https://www.welt.de/incoming/plus215699306/Gastkommentar-Fuenf-Ideen-die-Deutschland-zukunftsfest-machen.html"
"1140","Welt","Digitalisierung","Die Zukunft des unabhängigen Journalismus",2020-09-15,9,2020,"https://www.welt.de/kultur/article215768414/Mathias-Doepfner-ueber-die-Zukunft-des-unabhaengigen-Journalismus.html"
"1141","Welt","Digitalisierung","In diesen Firmen will die Generation Z glücklich werden",2020-09-22,9,2020,"https://www.welt.de/wirtschaft/karriere/plus216246676/LinkedIn-Ranking-Das-sind-Deutschlands-beliebteste-Start-ups.html"
"1142","Welt","Digitalisierung","Das sind die Ergebnisse des „Schulgipfels“",2020-09-22,9,2020,"https://www.welt.de/politik/deutschland/video216263338/Treffen-im-Kanzleramt-Das-sind-die-Ergebnisse-des-Schulgipfels.html"
"1143","Welt","Digitalisierung","Die Angst der Lehrer vor dem Laptoptablet",2020-09-22,9,2020,"https://www.welt.de/debatte/kommentare/article216336236/Schulgipfel-im-Kanzleramt-Die-Angst-der-Lehrer-vor-dem-Laptoptablet.html"
"1144","Welt","Digitalisierung","Digitalisierung der Schulen? So könnte es klappen!",2020-09-23,9,2020,"https://www.welt.de/debatte/kommentare/article216350444/Bildung-Digitalisierung-der-Schulen-So-koennte-es-klappen.html"
"1145","Welt","Digitalisierung","Mit dieser Liste sind Sparer bei allen Megatrends dabei",2020-09-23,9,2020,"https://www.welt.de/finanzen/plus216115198/ETF-Mit-dieser-Liste-sind-Sparer-bei-allen-Megatrends-dabei.html"
"1146","Welt","Digitalisierung","Wegen zwei Faktoren droht Deutschland die globale Außenseiterrolle",2020-09-24,9,2020,"https://www.welt.de/wirtschaft/plus216402502/Megatrends-Wegen-zwei-Effekten-droht-Deutschland-die-Aussenseiterrolle.html"
"1147","Welt","Digitalisierung","Corona-Krise beschleunigt Digitalisierung und bremst Globalisierung",2020-09-24,9,2020,"https://www.welt.de/wirtschaft/video216422530/Megatrend-Report-Corona-Krise-beschleunigt-Digitalisierung-und-bremst-Globalisierung.html"
"1148","Welt","Digitalisierung","Algorithmen sind politisch. Wir müssen lernen, damit umzugehen",2020-09-24,9,2020,"https://www.welt.de/debatte/kommentare/article216440072/Kuenstliche-Intelligenz-Algorithmen-sind-politisch.html"
"1149","Welt","Digitalisierung","So will die Justiz digital werden",2020-09-25,9,2020,"https://www.welt.de/regionales/hamburg/article216566390/Elektronische-Akte-So-will-die-Justiz-in-Hamburg-digital-werden.html"
"1150","Welt","Digitalisierung","Der Versuch, das digitale Universum zu vermessen",2020-09-29,9,2020,"https://www.welt.de/kultur/medien/article216500732/Forschungsprojekt-Der-Versuch-das-digitale-Universum-zu-vermessen.html"
"1151","Welt","Digitalisierung","Wenn der Lehrer-Laptop ins Leere läuft",2020-09-29,9,2020,"https://www.welt.de/debatte/kommentare/article216866260/Digitaler-Unterricht-Wenn-der-Lehrer-Laptop-ins-Leere-laeuft.html"
"1152","Welt","Digitalisierung","Im Wettlauf um den künftigen Wohlstand droht uns der Abstieg ins Mittelmaß",2020-10-01,10,2020,"https://www.welt.de/wirtschaft/article216944528/Digitale-Konkurrenzfaehigkeit-China-zieht-an-Deutschland-vorbei.html"
"1153","Welt","Digitalisierung","China auf dem Vormarsch, Deutschland steigt ab",2020-10-01,10,2020,"https://www.welt.de/wirtschaft/video216955278/Digitalranking-China-auf-dem-Vormarsch-Deutschland-steigt-ab.html"
"1154","Welt","Digitalisierung","Wir brauchen eine parallele Währung zu den Euro-Banknoten",2020-10-02,10,2020,"https://www.welt.de/wirtschaft/article217010162/Waehrung-Uns-fehlt-ein-digitaler-Euro-sagt-EZB-Direktor-Fabio-Panetta.html"
"1155","Welt","Digitalisierung","Axel-Springer-Neubau – Symbol für das neue Berlin",2020-10-04,10,2020,"https://www.welt.de/kultur/plus217120704/Der-Neubau-von-Rem-Koolhaas-fuer-Axel-Springer-Symbol-fuer-das-neue-Berlin.html"
"1156","Welt","Digitalisierung","Knick in RKI-Statistik – Das sind die Mängel in der Corona-Meldekette",2020-10-05,10,2020,"https://www.welt.de/politik/deutschland/plus217123300/Pandemie-Warum-die-Zahl-der-Corona-Infektionen-am-Sonntag-sinkt.html"
"1157","Welt","Digitalisierung","„Gewaltige Staatsbudgets fließen in TUI, Adidas oder andere kaputte Geschäftsmodelle“",2020-10-05,10,2020,"https://www.welt.de/wirtschaft/plus217129100/Middelhoff-und-Boersch-Gewaltige-Staatsbudgets-fliessen-in-kaputte-Geschaeftsmodelle.html"
"1158","Welt","Digitalisierung","Braucht wirklich jeder Lehrer einen Dienst-Laptop?",2020-10-07,10,2020,"https://www.welt.de/debatte/kommentare/article217312466/Corona-und-Schule-Braucht-wirklich-jeder-Lehrer-einen-Dienst-Laptop.html"
"1159","Welt","Digitalisierung","Angestellte gegen Arbeiter. Wollen wir das?",2020-10-09,10,2020,"https://www.welt.de/debatte/kommentare/article217486854/Mobile-Arbeit-Gesetz-Angestellte-gegen-Arbeiter-Wollen-wir-das.html"
