"","outlet","category","title","date","month","year","url"
"323","Wirtschaftswoche","Rassismus","150 Jahre Kanada Das kanadische Experiment",2017-07-01,7,2017,"https://www.wiwo.de/politik/ausland/150-jahre-kanada-das-kanadische-experiment/20007062.html"
"324","Wirtschaftswoche","Rassismus","Hamburg vor G20-Gipfel „Es gibt keine Übernachtungscamps“",2017-07-04,7,2017,"https://www.wiwo.de/politik/ausland/hamburg-vor-g20-gipfel-es-gibt-keine-uebernachtungscamps/20015434.html"
"325","Wirtschaftswoche","Rassismus","G20-Protest in Hamburg Polizei setzt Wasserwerfer gegen Kritiker ein",2017-07-05,7,2017,"https://www.wiwo.de/politik/ausland/g20-protest-in-hamburg-polizei-setzt-wasserwerfer-gegen-kritiker-ein/20020688.html"
"326","Wirtschaftswoche","Rassismus","G20-Demonstranten Sie wollen, was alle wollen – nur lauter",2017-07-06,7,2017,"https://www.wiwo.de/politik/deutschland/g20-demonstranten-sie-wollen-was-alle-wollen-nur-lauter/20023388.html"
"327","Wirtschaftswoche","Rassismus","The North Face Hoodies für den Schwarzen Block",2017-07-12,7,2017,"https://www.wiwo.de/unternehmen/industrie/the-north-face-hoodies-fuer-den-schwarzen-block/20051044.html"
"328","Wirtschaftswoche","Rassismus","Satire-Streit Erdogan legt Berufung wegen Böhmermann-Gedicht ein",2017-07-12,7,2017,"https://www.wiwo.de/politik/deutschland/satire-streit-erdogan-legt-berufung-wegen-boehmermann-gedicht-ein/20051956.html"
"329","Wirtschaftswoche","Rassismus","Ehemaliges KZ Dachau Martin Schulz enthüllt Gedenktafel",2017-07-21,7,2017,"https://www.wiwo.de/politik/deutschland/ehemaliges-kz-dachau-martin-schulz-enthuellt-gedenktafel/20093874.html"
"330","Wirtschaftswoche","Rassismus","Gedenkfeier in München „Der Amoklauf hat ganz Bayern ins Mark getroffen“",2017-07-22,7,2017,"https://www.wiwo.de/politik/deutschland/gedenkfeier-in-muenchen-der-amoklauf-hat-ganz-bayern-ins-mark-getroffen/20094396.html"
"331","Wirtschaftswoche","Rassismus","Südafrika Wie eine privatisierte Regierung",2017-08-12,8,2017,"https://www.wiwo.de/unternehmen/industrie/suedafrika-wie-eine-privatisierte-regierung/20140746.html"
"332","Wirtschaftswoche","Rassismus","Virginia Der Aufstand der Ewiggestrigen",2017-08-13,8,2017,"https://www.wiwo.de/politik/ausland/virginia-der-aufstand-der-ewiggestrigen/20183058.html"
"333","Wirtschaftswoche","Rassismus","Weißes Haus „Natürlich“ meinte Trump extremistische Gruppen",2017-08-14,8,2017,"https://www.wiwo.de/politik/ausland/weisses-haus-natuerlich-meinte-trump-extremistische-gruppen/20183696.html"
"334","Wirtschaftswoche","Rassismus","Merck, Intel, Under Armour US-Manager bieten Trump die Stirn",2017-08-14,8,2017,"https://www.wiwo.de/unternehmen/merck-intel-under-armour-us-manager-bieten-trump-die-stirn/20187538.html"
"335","Wirtschaftswoche","Rassismus","Nach Gewalt in Charlottesville Sessions verteidigt Trumps Reaktion",2017-08-14,8,2017,"https://www.wiwo.de/politik/ausland/nach-gewalt-in-charlottesville-sessions-verteidigt-trumps-reaktion/20188234.html"
"336","Wirtschaftswoche","Rassismus","USA Trump verurteilt rassistische Gewalt von Charlottesville",2017-08-14,8,2017,"https://www.wiwo.de/politik/ausland/usa-trump-verurteilt-rassistische-gewalt-von-charlottesville/20188340.html"
"337","Wirtschaftswoche","Rassismus","Analyse der Ausschreitungen in Charlottesville Wie Trump Hass und Gewalt bestärkt",2017-08-16,8,2017,"https://www.wiwo.de/politik/ausland/analyse-der-ausschreitungen-in-charlottesville-wie-trump-hass-und-gewalt-bestaerkt/20194492.html"
"338","Wirtschaftswoche","Rassismus","Gewalt in Charlottesville Maas bezeichnet Trumps Äußerungen als unerträglich",2017-08-16,8,2017,"https://www.wiwo.de/politik/ausland/gewalt-in-charlottesville-maas-bezeichnet-trumps-aeusserungen-als-unertraeglich/20195504.html"
"339","Wirtschaftswoche","Rassismus","Nach Charlottesville Kritik an Trump wächst nach Äußerungen zu Gewalt in Virginia",2017-08-16,8,2017,"https://www.wiwo.de/politik/ausland/nach-charlottesville-kritik-an-trump-waechst-nach-aeusserungen-zu-gewalt-in-virginia/20196514.html"
"340","Wirtschaftswoche","Rassismus","Nach Rücktritten Trump löst Beratergremien mit Konzernchefs auf",2017-08-16,8,2017,"https://www.wiwo.de/politik/ausland/nach-ruecktritten-trump-loest-beratergremien-mit-konzernchefs-auf/20198526.html"
"341","Wirtschaftswoche","Rassismus","Charlotte Knobloch zu Charlottesville „Das lässt das Blut in den Adern gefrieren“",2017-08-17,8,2017,"https://www.wiwo.de/politik/deutschland/charlotte-knobloch-zu-charlottesville-das-laesst-das-blut-in-den-adern-gefrieren/20201748.html"
"342","Wirtschaftswoche","Rassismus","US-Debatte über Rassismus Kein Republikaner will Trump verteidigen",2017-08-17,8,2017,"https://www.wiwo.de/politik/ausland/us-debatte-ueber-rassismus-kein-republikaner-will-trump-verteidigen/20201882.html"
"343","Wirtschaftswoche","Rassismus","Tech-Konzerne gegen Trump „Wir dürfen diesen Hass nicht erlauben“",2017-08-17,8,2017,"https://www.wiwo.de/unternehmen/it/tech-konzerne-gegen-trump-wir-duerfen-diesen-hass-nicht-erlauben/20201992.html"
"344","Wirtschaftswoche","Rassismus","Rassismus-Debatte in den USA Republikaner rücken von Trump ab",2017-08-17,8,2017,"https://www.wiwo.de/politik/ausland/rassismus-debatte-in-den-usa-republikaner-ruecken-von-trump-ab/20203580.html"
"345","Wirtschaftswoche","Rassismus","Smoothie-Hersteller True Fruits Wieder mal in aller Munde",2017-08-17,8,2017,"https://www.wiwo.de/unternehmen/mittelstand/smoothie-hersteller-true-fruits-wieder-mal-in-aller-munde/20204142.html"
"346","Wirtschaftswoche","Rassismus","Rassismus-Debatte in den USA Trump-Berater und Fed-Aspirant Cohn denkt offenbar an Rücktritt",2017-08-17,8,2017,"https://www.wiwo.de/politik/ausland/rassismus-debatte-in-den-usa-trump-berater-und-fed-aspirant-cohn-denkt-offenbar-an-ruecktritt/20204916.html"
"347","Wirtschaftswoche","Rassismus","Börse Frankfurt Trump bereitet Dax-Anlegern Kopfschmerzen",2017-08-18,8,2017,"https://www.wiwo.de/finanzen/boerse/boerse-frankfurt-trump-bereitet-dax-anlegern-kopfschmerzen/20205860.html"
"348","Wirtschaftswoche","Rassismus","Tipps für den Umgang mit Rassisten Schwarzenegger schreibt Trump eine Rede",2017-08-18,8,2017,"https://www.wiwo.de/politik/ausland/tipps-fuer-den-umgang-mit-rassisten-schwarzenegger-schreibt-trump-eine-rede/20208798.html"
"349","Wirtschaftswoche","Rassismus","Früherer Chefstratege Bannon „Für Trump weiter in den Krieg ziehen“",2017-08-20,8,2017,"https://www.wiwo.de/politik/ausland/frueherer-chefstratege-bannon-fuer-trump-weiter-in-den-krieg-ziehen/20212350.html"
"350","Wirtschaftswoche","Rassismus","Nach Äußerungen über Ereignisse in Charlottesville Trump geht mit Großkundgebung in die Offensive",2017-08-20,8,2017,"https://www.wiwo.de/politik/ausland/nach-aeusserungen-ueber-ereignisse-in-charlottesville-trump-geht-mit-grosskundgebung-in-die-offensive/20213162.html"
"351","Wirtschaftswoche","Rassismus","Rechtsextremismus Rostock gedenkt der rassistischen Krawalle in Lichtenhagen",2017-08-22,8,2017,"https://www.wiwo.de/politik/deutschland/rechtsextremismus-rostock-gedenkt-der-rassistischen-krawalle-in-lichtenhagen/20224820.html"
"352","Wirtschaftswoche","Rassismus","Rede in Phoenix Donald Trump droht mit ""government shutdown""",2017-08-23,8,2017,"https://www.wiwo.de/politik/ausland/rede-in-phoenix-donald-trump-droht-mit-government-shutdown/20226164.html"
"353","Wirtschaftswoche","Rassismus","Nach rassistischen Demos UN geht gegen US-Regierung vor",2017-08-23,8,2017,"https://www.wiwo.de/politik/ausland/nach-rassistischen-demos-un-geht-gegen-us-regierung-vor/20228376.html"
"354","Wirtschaftswoche","Rassismus","Linksextreme in den USA Gewalt statt Dialog",2017-08-26,8,2017,"https://www.wiwo.de/politik/ausland/linksextreme-in-den-usa-gewalt-statt-dialog/20242452.html"
"355","Wirtschaftswoche","Rassismus","Rassismus in den USA Der Streit um die Konföderierten-Generäle von Stone Mountain",2017-08-27,8,2017,"https://www.wiwo.de/politik/ausland/rassismus-in-den-usa-der-streit-um-die-konfoederierten-generaele-von-stone-mountain/20243270.html"
"356","Wirtschaftswoche","Rassismus","Rassismus-Aussagen Tillerson distanziert sich von Trump",2017-08-28,8,2017,"https://www.wiwo.de/politik/ausland/rassismus-aussagen-tillerson-distanziert-sich-von-trump/20245402.html"
"357","Wirtschaftswoche","Rassismus","Alexander Gauland Spitzenpolitiker reagieren empört auf „Entgleisung“",2017-08-28,8,2017,"https://www.wiwo.de/politik/deutschland/alexander-gauland-spitzenpolitiker-reagieren-empoert-auf-entgleisung/20247772.html"
"358","Wirtschaftswoche","Rassismus","AfD-Spitzenkandidat Gauland spricht von „Entsorgung“ Aydan Özoguz'",2017-08-28,8,2017,"https://www.wiwo.de/politik/deutschland/afd-spitzenkandidat-gauland-spricht-von-entsorgung-aydan-oezoguz/20248058.html"
"359","Wirtschaftswoche","Rassismus","Alexander Gauland Kein Anlass für Entschuldigung bei Özoguz",2017-08-29,8,2017,"https://www.wiwo.de/politik/deutschland/alexander-gauland-kein-anlass-fuer-entschuldigung-bei-oezoguz/20251522.html"
"360","Wirtschaftswoche","Rassismus","Nach TV-Debatte Erdogan-Sprecher weist Kritik an der Türkei zurück",2017-09-04,9,2017,"https://www.wiwo.de/politik/europa/nach-tv-debatte-erdogan-sprecher-weist-kritik-an-der-tuerkei-zurueck/20278758.html"
"361","Wirtschaftswoche","Rassismus","Bundestagsparteien warnen vor der AfD  Gemeinsam gegen „Fanatiker und Fundamentalisten“",2017-09-05,9,2017,"https://www.wiwo.de/politik/deutschland/bundestagsparteien-warnen-vor-der-afd-gemeinsam-gegen-fanatiker-und-fundamentalisten/20288070.html"
"362","Wirtschaftswoche","Rassismus","Sprache „Political Correctness nervt jeden ab einem gewissen Punkt""",2017-09-11,9,2017,"https://www.wiwo.de/lifestyle/sprache-political-correctness-nervt-jeden-ab-einem-gewissen-punkt/20309388.html"
"363","Wirtschaftswoche","Rassismus","Kuriose Debatte in der Schweiz Darf man noch „Mohrenkopf“ sagen?",2017-09-14,9,2017,"https://www.wiwo.de/unternehmen/handel/kuriose-debatte-in-der-schweiz-darf-man-noch-mohrenkopf-sagen/20327578.html"
"364","Wirtschaftswoche","Rassismus","„Klartext, Frau Merkel“ Scharfe Kritik und eine Liebeserklärung",2017-09-15,9,2017,"https://www.wiwo.de/politik/deutschland/klartext-frau-merkel-scharfe-kritik-und-eine-liebeserklaerung/20333126.html"
"365","Wirtschaftswoche","Rassismus","Merkel im Kreuzfeuer „Das ist ein Witz, was sie erzählen""",2017-09-15,9,2017,"https://www.wiwo.de/politik/deutschland/bundestagswahl-2017/merkel-im-kreuzfeuer-das-ist-ein-witz-was-sie-erzaehlen/20333350.html"
"366","Wirtschaftswoche","Rassismus","US-Präsident Trump unterschreibt Resolution gegen Rassismus",2017-09-15,9,2017,"https://www.wiwo.de/politik/ausland/us-praesident-trump-unterschreibt-resolution-gegen-rassismus/20333568.html"
"367","Wirtschaftswoche","Rassismus","USA Donald Trump unterschreibt Resolution gegen Rassismus",2017-09-15,9,2017,"https://www.wiwo.de/politik/ausland/usa-donald-trump-unterschreibt-resolution-gegen-rassismus/20333580.html"
"368","Wirtschaftswoche","Rassismus","Front National zerlegt sich Wie Marine Le Pens Träume zerplatzen",2017-09-21,9,2017,"https://www.wiwo.de/politik/ausland/front-national-zerlegt-sich-wie-marine-le-pens-traeume-zerplatzen-/20359912.html"
"369","Wirtschaftswoche","Rassismus","Angela Merkel oder Martin Schulz? So denkt die Welt über die Bundestagswahl",2017-09-23,9,2017,"https://www.wiwo.de/politik/ausland/angela-merkel-oder-martin-schulz-so-denkt-die-welt-ueber-die-bundestagswahl/20367896.html"
"370","Wirtschaftswoche","Rassismus","+++Wahlticker+++ Trittin und Kretschmann im Jamaika-Sondierungsteam der Grünen",2017-09-24,9,2017,"https://www.wiwo.de/politik/deutschland/bundestagswahl-2017/wahlticker-trittin-und-kretschmann-im-jamaika-sondierungsteam-der-gruenen/20359254.html"
"371","Wirtschaftswoche","Rassismus","Nach dem AfD-Wahlergebnis Verbände wollen politische Arbeit in Sachsen verstärken",2017-09-27,9,2017,"https://www.wiwo.de/politik/deutschland/nach-dem-afd-wahlergebnis-verbaende-wollen-politische-arbeit-in-sachsen-verstaerken/20383810.html"
"372","Wirtschaftswoche","Rassismus","Terrassengespräch „Fakten sind Verhandlungssache geworden“",2017-09-30,9,2017,"https://www.wiwo.de/politik/ausland/terrassengespraech-fakten-sind-verhandlungssache-geworden/20399904.html"
"373","Wirtschaftswoche","Rassismus","Interview mit Volker Beck „In der CDU und in der CSU sind ja keine Unmenschen“",2017-10-01,10,2017,"https://www.wiwo.de/politik/deutschland/interview-mit-volker-beck-in-der-cdu-und-in-der-csu-sind-ja-keine-unmenschen/20401974.html"
"374","Wirtschaftswoche","Rassismus","Diversity Diese Frau verlangt Respekt",2017-10-18,10,2017,"https://www.wiwo.de/my/erfolg/beruf/diversity-diese-frau-verlangt-respekt/20445222.html"
"375","Wirtschaftswoche","Rassismus","Demonstration gegen die AfD „Gegen Hass und Rassismus im Bundestag“",2017-10-22,10,2017,"https://www.wiwo.de/politik/deutschland/demonstration-gegen-die-afd-gegen-hass-und-rassismus-im-bundestag/20488346.html"
"376","Wirtschaftswoche","Rassismus","Kevin-Prince Boateng über die AfD „Die wachsen und wachsen und keiner haut dazwischen“",2017-11-19,11,2017,"https://www.wiwo.de/politik/deutschland/kevin-prince-boateng-ueber-die-afd-die-wachsen-und-wachsen-und-keiner-haut-dazwischen/20604270.html"
"377","Wirtschaftswoche","Rassismus","Rassismus-Vorwurf gegen Leipziger Professor „Das sind geschichtsfälschende Fakenews“",2017-11-23,11,2017,"https://www.wiwo.de/politik/deutschland/rassismus-vorwurf-gegen-leipziger-professor-das-sind-geschichtsfaelschende-fakenews/20623264.html"
"378","Wirtschaftswoche","Rassismus","Besuch in Myanmar Der Papst und das verbotene Wort",2017-11-28,11,2017,"https://www.wiwo.de/politik/ausland/besuch-in-myanmar-der-papst-und-das-verbotene-wort/20641266.html"
"379","Wirtschaftswoche","Rassismus","Replik Ein Kompromiss ist besser als radikale Verweigerung",2017-12-04,12,2017,"https://www.wiwo.de/politik/deutschland/replik-ein-kompromiss-ist-besser-als-radikale-verweigerung/20668634.html"
"380","Wirtschaftswoche","Rassismus","Twitter in Deutschland Das sind die Top-Tweets 2017",2017-12-05,12,2017,"https://www.wiwo.de/technologie/twitter-in-deutschland-das-sind-die-top-tweets-2017/20673874.html"
"381","Wirtschaftswoche","Rassismus","Absturz bei der Bundestagswahl Wahldesaster kommt SPD teuer zu stehen",2017-12-06,12,2017,"https://www.wiwo.de/politik/deutschland/absturz-bei-der-bundestagswahl-wahldesaster-kommt-spd-teuer-zu-stehen/20676138.html"
"382","Wirtschaftswoche","Rassismus","Gespräch mit Rivlin Steinmeier verurteilt Flaggenverbrennung",2017-12-14,12,2017,"https://www.wiwo.de/politik/deutschland/gespraech-mit-rivlin-steinmeier-verurteilt-flaggenverbrennung/20714024.html"
"383","Wirtschaftswoche","Rassismus","Europäische Beziehungen Erdogan will mehr Freunde für die Türkei",2017-12-28,12,2017,"https://www.wiwo.de/politik/ausland/europaeische-beziehungen-erdogan-will-mehr-freunde-fuer-die-tuerkei/20796106.html"
"384","Wirtschaftswoche","Rassismus","Laschet vs. AfD CDU-Vize sieht „kriminelle Energie“ bei AfD",2018-01-04,1,2018,"https://www.wiwo.de/politik/deutschland/laschet-vs-afd-cdu-vize-sieht-kriminelle-energie-bei-afd/20811412.html"
"385","Wirtschaftswoche","Rassismus","Nach AfD-Beschimpfung  Boris Becker fordert mehr Engagement gegen Rassismus",2018-01-07,1,2018,"https://www.wiwo.de/politik/deutschland/nach-afd-beschimpfung-boris-becker-fordert-mehr-engagement-gegen-rassismus/20820370.html"
"386","Wirtschaftswoche","Rassismus","Modekonzern Krisenzeiten bei H&M",2018-01-10,1,2018,"https://www.wiwo.de/unternehmen/handel/modekonzern-krisenzeiten-bei-hundm/20832482.html"
"387","Wirtschaftswoche","Rassismus","Charlotte Knobloch über die AfD „Antisemitisch, rassistisch, völkisch“",2018-01-10,1,2018,"https://www.wiwo.de/politik/deutschland/charlotte-knobloch-ueber-die-afd-antisemitisch-rassistisch-voelkisch/20834868.html"
"388","Wirtschaftswoche","Rassismus","OSZE-Vorsitz  Italien will neue Partnerschaft im Mittelmeer-Raum",2018-01-11,1,2018,"https://www.wiwo.de/politik/ausland/osze-vorsitz-italien-will-neue-partnerschaft-im-mittelmeer-raum/20838438.html"
"389","Wirtschaftswoche","Rassismus","Nach heftigen Protesten H&M-Läden in Südafrika vorerst geschlossen",2018-01-13,1,2018,"https://www.wiwo.de/unternehmen/handel/nach-heftigen-protesten-hundm-laeden-in-suedafrika-vorerst-geschlossen/20844828.html"
"390","Wirtschaftswoche","Rassismus","Alltagsrassismus „Dieser kleine Moment der Stille“",2018-01-14,1,2018,"https://www.wiwo.de/politik/deutschland/alltagsrassismus-dieser-kleine-moment-der-stille/20845770.html"
"391","Wirtschaftswoche","Rassismus","Trump nach ""Drecksloch""-Kommentar ""Ich bin kein Rassist""",2018-01-15,1,2018,"https://www.wiwo.de/politik/ausland/trump-nach-drecksloch-kommentar-ich-bin-kein-rassist/20846766.html"
"392","Wirtschaftswoche","Rassismus","Rassismus-Skandal in Großbritannien Ukip-Vorstand spricht Parteichef Misstrauen aus",2018-01-22,1,2018,"https://www.wiwo.de/politik/ausland/rassismus-skandal-in-grossbritannien-ukip-vorstand-spricht-parteichef-misstrauen-aus/20873626.html"
"393","Wirtschaftswoche","Rassismus","Österreich Nazi-Liedgut-Skandal schadet Rechtskoalition",2018-01-25,1,2018,"https://www.wiwo.de/politik/ausland/oesterreich-nazi-liedgut-skandal-schadet-rechtskoalition/20886520.html"
"394","Wirtschaftswoche","Rassismus","Parteitag billigt Sonderregelung Grüne machen Weg frei für Habeck",2018-01-27,1,2018,"https://www.wiwo.de/politik/deutschland/parteitag-billigt-sonderregelung-gruene-machen-weg-frei-fuer-habeck/20899028.html"
"395","Wirtschaftswoche","Rassismus","Rassismus-Debatte Jay-Z nennt Trump „Superwanze“",2018-01-29,1,2018,"https://www.wiwo.de/politik/ausland/rassismus-debatte-jay-z-nennt-trump-superwanze/20901674.html"
"396","Wirtschaftswoche","Rassismus","Trumps Rede zur Lage der Nation Emotion statt Aggression",2018-01-31,1,2018,"https://www.wiwo.de/politik/ausland/trumps-rede-zur-lage-der-nation-emotion-statt-aggression/20909512.html"
"397","Wirtschaftswoche","Rassismus","H&M Gewinneinbruch nach dem Rassismus-Skandal",2018-01-31,1,2018,"https://www.wiwo.de/unternehmen/handel/hundm-gewinneinbruch-nach-dem-rassismus-skandal/20911898.html"
"398","Wirtschaftswoche","Rassismus","Debatte über Migration Zehntausende demonstrieren in Italien gegen Rassismus",2018-02-10,2,2018,"https://www.wiwo.de/politik/ausland/debatte-ueber-migration-zehntausende-demonstrieren-in-italien-gegen-rassismus/20949490.html"
"399","Wirtschaftswoche","Rassismus","Politischer Aschermittwoch Türkische Gemeinde prüft nach AfD-Attacken rechtliche Schritte",2018-02-15,2,2018,"https://www.wiwo.de/politik/deutschland/politischer-aschermittwoch-tuerkische-gemeinde-prueft-nach-afd-attacken-rechtliche-schritte/20964676.html"
"400","Wirtschaftswoche","Rassismus","Fünf Konfliktherde Darüber streiten Deutschland und die Türkei",2018-02-15,2,2018,"https://www.wiwo.de/politik/ausland/fuenf-konfliktherde-darueber-streiten-deutschland-und-die-tuerkei/20966068.html"
"401","Wirtschaftswoche","Rassismus","Islamfeindliche Bewegung AfD-Vorsitzende können sich Kooperation mit Pegida doch vorstellen",2018-02-21,2,2018,"https://www.wiwo.de/politik/deutschland/islamfeindliche-bewegung-afd-vorsitzende-koennen-sich-kooperation-mit-pegida-doch-vorstellen/20989480.html"
"402","Wirtschaftswoche","Rassismus","Rassismus & Arbeitsrechtsreformen Tausende demonstrieren in Italien eine Woche vor der Wahl",2018-02-24,2,2018,"https://www.wiwo.de/politik/ausland/rassismus-und-arbeitsrechtsreformen-tausende-demonstrieren-in-italien-eine-woche-vor-der-wahl/21001162.html"
"403","Wirtschaftswoche","Rassismus","Innenpolitik  AfD will ausländische Gefährder präventiv einsperren",2018-02-27,2,2018,"https://www.wiwo.de/politik/deutschland/innenpolitik-afd-will-auslaendische-gefaehrder-praeventiv-einsperren/21009274.html"
"404","Wirtschaftswoche","Rassismus","Jahresbericht Eco-Beschwerdestelle 80 Tage fürs Löschen – Warum der Kampf gegen Hass im Netz so schwierig ist",2018-03-06,3,2018,"https://www.wiwo.de/politik/deutschland/jahresbericht-eco-beschwerdestelle-80-tage-fuers-loeschen-warum-der-kampf-gegen-hass-im-netz-so-schwierig-ist/21038634.html"
"405","Wirtschaftswoche","Rassismus","Weltmeisterschaft BKA warnt vor Terrorgefahr bei Fußball-WM",2018-03-06,3,2018,"https://www.wiwo.de/politik/deutschland/weltmeisterschaft-bka-warnt-vor-terrorgefahr-bei-fussball-wm/21040158.html"
"406","Wirtschaftswoche","Rassismus","Ex-Trump-Berater Bannon will mit Kryptowährungen den Zentralbanken die Kontrolle wegnehmen",2018-03-07,3,2018,"https://www.wiwo.de/politik/ausland/ex-trump-berater-bannon-will-mit-kryptowaehrungen-den-zentralbanken-die-kontrolle-wegnehmen/21043172.html"
"407","Wirtschaftswoche","Rassismus","Debatte um Überwachung von Partei Verfassungsschutz hat die AfD genau im Blick",2018-03-08,3,2018,"https://www.wiwo.de/politik/deutschland/debatte-um-ueberwachung-von-partei-verfassungsschutz-hat-die-afd-genau-im-blick/21046808.html"
"408","Wirtschaftswoche","Rassismus","Bundesregierung Welches Risiko die SPD mit ihrer Minister-Riege eingeht",2018-03-09,3,2018,"https://www.wiwo.de/politik/deutschland/bundesregierung-welches-risiko-die-spd-mit-ihrer-minister-riege-eingeht/21053836.html"
"409","Wirtschaftswoche","Rassismus","Union und Grüne machen Druck Bundesregierung soll Kampf gegen Antisemitismus forcieren",2018-03-09,3,2018,"https://www.wiwo.de/politik/deutschland/union-und-gruene-machen-druck-bundesregierung-soll-kampf-gegen-antisemitismus-forcieren/21055910.html"
"410","Wirtschaftswoche","Rassismus","NetzDG Staatsrechtler hält Anti-Hass-Gesetz für verfassungsgemäß",2018-03-20,3,2018,"https://www.wiwo.de/politik/deutschland/netzdg-staatsrechtler-haelt-anti-hass-gesetz-fuer-verfassungsgemaess/21089494.html"
"411","Wirtschaftswoche","Rassismus","„Sometimes, lighter is better“ Heineken zieht Werbespot nach Rassismus-Vorwürfen zurück",2018-03-27,3,2018,"https://www.wiwo.de/unternehmen/handel/sometimes-lighter-is-better-heineken-zieht-werbespot-nach-rassismus-vorwuerfen-zurueck/21118386.html"
"412","Wirtschaftswoche","Rassismus","Rechtspopulismus-Forscher „Die Mehrheit der Gesellschaft lehnt die AfD strikt ab“",2018-04-14,4,2018,"https://www.wiwo.de/politik/deutschland/rechtspopulismus-forscher-die-mehrheit-der-gesellschaft-lehnt-die-afd-strikt-ab/21175616.html"
"413","Wirtschaftswoche","Rassismus","Analyse Langes Überleben oder schnelles Scheitern – wovon die Zukunft der AfD abhängt",2018-04-15,4,2018,"https://www.wiwo.de/politik/deutschland/analyse-langes-ueberleben-oder-schnelles-scheitern-wovon-die-zukunft-der-afd-abhaengt/21176626.html"
"414","Wirtschaftswoche","Rassismus","Nach Rassismus-Skandal Starbucks schließt 8000 Cafés für Anti-Diskriminierungs-Kurs",2018-04-18,4,2018,"https://www.wiwo.de/unternehmen/dienstleister/nach-rassismus-skandal-starbucks-schliesst-8000-cafes-fuer-anti-diskriminierungs-kurs/21186646.html"
"415","Wirtschaftswoche","Rassismus","Studien zur Wahl in Italien und Deutschland Wie rechte Internetaktivisten europäische Wahlen beeinflussen",2018-04-18,4,2018,"https://www.wiwo.de/politik/ausland/studien-zur-wahl-in-italien-und-deutschland-wie-rechte-internetaktivisten-europaeische-wahlen-beeinflussen/21188072.html"
"416","Wirtschaftswoche","Rassismus","Kaffeerestaurant-Kette Starbucks nach Quartalszahlen an der Börse unter Druck",2018-04-27,4,2018,"https://www.wiwo.de/unternehmen/handel/kaffeerestaurant-kette-starbucks-nach-quartalszahlen-an-der-boerse-unter-druck/21220938.html"
"417","Wirtschaftswoche","Rassismus","Äußerung auf Parteitag Habeck und Klöckner nehmen FDP-Chef Lindner in Rassismus-Debatte in Schutz",2018-05-14,5,2018,"https://www.wiwo.de/politik/deutschland/aeusserung-auf-parteitag-habeck-und-kloeckner-nehmen-fdp-chef-lindner-in-rassismus-debatte-in-schutz/22048910.html"
"418","Wirtschaftswoche","Rassismus","Rechte Arbeitnehmervertreter Unruhe in der CDU wegen AfD-naher Betriebsräte",2018-05-16,5,2018,"https://www.wiwo.de/politik/deutschland/rechte-arbeitnehmervertreter-unruhe-in-der-cdu-wegen-afd-naher-betriebsraete/22571870.html"
"419","Wirtschaftswoche","Rassismus","Brandanschlag von Solingen Maas gedenkt den Toten von Solingen – „Angriff auf das, was Deutschland ausmacht“",2018-05-29,5,2018,"https://www.wiwo.de/politik/deutschland/brandanschlag-von-solingen-maas-gedenkt-den-toten-von-solingen-angriff-auf-das-was-deutschland-ausmacht/22618024.html"
"420","Wirtschaftswoche","Rassismus","25 Jahre nach Solingen Maas ruft zu mehr Zivilcourage im Kampf gegen Rechts auf",2018-05-29,5,2018,"https://www.wiwo.de/politik/deutschland/25-jahre-nach-solingen-maas-ruft-zu-mehr-zivilcourage-im-kampf-gegen-rechts-auf/22621768.html"
"421","Wirtschaftswoche","Rassismus","Regierungsbildung Die Köpfe hinter der neuen italienischen Wirtschaftspolitik",2018-06-01,6,2018,"https://www.wiwo.de/politik/europa/regierungsbildung-die-koepfe-hinter-der-neuen-italienischen-wirtschaftspolitik/22631730.html"
"422","Wirtschaftswoche","Rassismus","Nach über 30 Jahren „Mr. Starbucks“ geht von Bord",2018-06-05,6,2018,"https://www.wiwo.de/my/unternehmen/dienstleister/nach-ueber-30-jahren-mr-starbucks-geht-von-bord/22643082.html"
"423","Wirtschaftswoche","Rassismus","Mordfall Susanna Ali B. hat Mord an Susanna wohl gestanden - Auslieferung nach Deutschland am Samstagabend",2018-06-09,6,2018,"https://www.wiwo.de/politik/deutschland/mordfall-susanna-ali-b-hat-mord-an-susanna-wohl-gestanden-auslieferung-nach-deutschland-am-samstagabend/22666794.html"
"424","Wirtschaftswoche","Rassismus","Parteitag Rede von Linksfraktionschefin Wagenknecht sorgt für Eklat",2018-06-10,6,2018,"https://www.wiwo.de/politik/deutschland/parteitag-rede-von-linksfraktionschefin-wagenknecht-sorgt-fuer-eklat-/22668196.html"
